3012;Adjektive und Adverbien;real adj;tatsächlich;He told the real story behind it.;Er hat die tatsächliche Geschichte dahinter erzählt.;Is this ring real gold?;Ist dieser Ring echt Gold?;;;;;;;;;;;;;;;;;;;;;;
3013;Substantive;fact n;die Tatsache;This paper is known for distorting the facts.;Diese Zeitung ist bekannt dafür, dass sie die Tatsachen verzerrt.;You should stick to the facts.;Du solltest dich an die Tatsachen halten.;;;;;;;;;;;;;;;;;;;;;;
3014;Adjektive und Adverbien;objective adj;objektiv;As a reporter I always try to be objective.;Als Berichterstatter bin ich immer bemüht, objektiv zu sein.;;;;;;;;;;;;;;;;;;;;;;;;
3015;Adjektive und Adverbien;incredible adj;unglaublich;Have you seen the news? Incredible what happened there.;Hast du die Nachrichten gesehen? Unglaublich, was da passiert ist.;;;;;;;;;;;;;;;;;;;;;;;;
3016;Substantive;telephone n, phone n;das Telefon;My telephone has been temporarily disconnected.;Mein Telefon war vorübergehend abgeschaltet.;May I use your phone?;Darf ich Ihr Telefon benutzen?;Your father is on the telephone.;Dein Vater ist am Telefon.;;;;;;;;;;;;;;;;;;;;
3017;Verben;phone v;anrufen;Could you phone me about an hour before you arrive?;Könntest du mich etwa eine Stunde vor deiner Ankunft anrufen?;She'd been phoning all morning.;Sie hatte den ganzen Morgen (herum)telefoniert.;Did you phone Bill?;Hast du Bill angerufen?;;;;;;;;;;;;;;;;;;;;
3018;Sonstige;to be on the phone;telefonieren;You mustn't disturb him at the moment. He is on the phone.;Du darfst ihn jetzt nicht stören. Er telefoniert gerade.;;;;;;;;;;;;;;;;;;;;;;;;
3019;Substantive;mobile (phone) n BE;das Handy BE;You can always reach me on my mobile phone.;Du kannst mich immer auf meinem Handy erreichen.;I'd be lost without my mobile phone.;Ohne mein Handy wäre ich aufgeschmissen.;;;;;;;;;;;;;;;;;;;;;;
3020;Substantive;cellphone n AE;das Handy AE;Is it illegal to use a cellphone while driving?;Ist der Gebrauch eines Handys beim Autofahren verboten?;;;;;;;;;;;;;;;;;;;;;;;;
3021;Verben;ring v;anrufen, klingeln;Carl rang her three times but she never answered the phone.;Carl hat sie dreimal angerufen, aber sie ist nicht rangegangen.;Your mobile is ringing. Shall I answer it?;Dein Handy klingelt. Soll ich drangehen?;The bell rang.;Die Glocke läutete.;;;;;;;;;;;;;;;;;;;;
3022;Sonstige;to give sb. a ring BE;anrufen BE;Give me a ring as soon as you arrive.;Ruf mich an, sobald du ankommst!;;;;;;;;;;;;;;;;;;;;;;;;
3023;Substantive;call n;der Anruf;Where's Tom? There's a call for him from Seattle.;Wo ist Tom? Da ist ein Anruf aus Seattle für ihn.;Here's a call for you.;Hier ist ein Anruf für Sie.;;;;;;;;;;;;;;;;;;;;;;
3024;Substantive;phone call n;das Telefongespräch;All your phone calls are listed on your phone bill.;Auf Ihrer Telefonrechnung sind alle Telefongespräche aufgelistet.;;;;;;;;;;;;;;;;;;;;;;;;
3025;Verben;dial v;wählen;First dial 1 and then the number.;Wählen Sie zuerst die 1 und dann die Nummer.;Dial 343 921.;Wählen Sie (die Telefonnummer) 343 921.;;;;;;;;;;;;;;;;;;;;;;
3026;Sonstige;to dial the wrong number;sich verwählen;I'm sorry, you must have dialled the wrong number.;Tut mir leid, Sie müssen sich verwählt haben.;;;;;;;;;;;;;;;;;;;;;;;;
3027;Sonstige;Who am I speaking to?;Wer ist am Apparat?;;;;;;;;;;;;;;;;;;;;;;;;;;
3028;Sonstige;to phone back BE;zurückrufen BE;I asked Diane to phone me back as soon as she knows any more.;Ich habe Diane gebeten, mich zurückzurufen, sobald sie mehr weiß.;;;;;;;;;;;;;;;;;;;;;;;;
3029;Sonstige;to call back AE;zurückrufen AE;Matt called them back to confirm the appointment.;Matt hat sie zurückgerufen, um den Termin zu bestätigen.;;;;;;;;;;;;;;;;;;;;;;;;
3030;Adjektive und Adverbien;engaged adj BE;besetzt BE;All the lines are engaged. Please try again.;Alle Leitungen sind besetzt. Bitte versuchen Sie es noch einmal.;;;;;;;;;;;;;;;;;;;;;;;;
3031;Substantive;dialling code n BE;die Vorwahl BE;Are you sure the dialling code for London is 020?;Bist du sicher, dass die Vorwahl von London 020 ist?;;;;;;;;;;;;;;;;;;;;;;;;
3032;Substantive;area code n AE;die Vorwahl AE;What's the area code for Omaha, Nebraska?;Was ist die Vorwahl von Omaha, Nebraska?;;;;;;;;;;;;;;;;;;;;;;;;
3033;Substantive;answerphone n BE;der Anrufbeantworter BE;Leave a message on my answerphone.;Hinterlassen Sie eine Nachricht auf meinem Anrufbeantworter.;;;;;;;;;;;;;;;;;;;;;;;;
3034;Substantive;answering machine n AE;der Anrufbeantworter AE;Hi, this is Joe's answering machine.;Hallo, hier spricht Joes Anrufbeantworter.;She left a message on the answering machine.;Sie hinterließ eine Nachricht auf dem Anrufbeantworter.;;;;;;;;;;;;;;;;;;;;;;
3035;Substantive;fax n;das Fax;I'll send you the report by fax or e-mail.;Ich werde dir den Bericht per Fax oder E-Mail schicken.;Can you send a fax for me?;Können Sie für mich ein Fax schicken?;Did you get my fax?;Haben Sie mein Fax bekommen?;;;;;;;;;;;;;;;;;;;;
3036;Substantive;Internet n;das Internet;Why don't you look up her new number on the Internet?;Warum schaust du ihre neue Nummer nicht im Internet nach?;;;;;;;;;;;;;;;;;;;;;;;;
3037;Substantive;e-mail n;die E-Mail;They asked me to send my application by e-mail.;Sie haben mich gebeten, meine Bewerbung per E-Mail zu schicken.;E-mail is the fastest way to send written information.;E-Mail ist der schnellste Weg, schriftliche Informationen zu verschicken.;You can reach me by phone, fax or e-mail.;Sie können mich per Telefon, Fax oder E-Mail erreichen.;;;;;;;;;;;;;;;;;;;;
3038;Verben;e-mail v;e-mailen, eine E-Mail schreiben;Marcus e-mailed her last night.;Marcus hat ihr gestern Abend eine E-Mail geschrieben.;;;;;;;;;;;;;;;;;;;;;;;;
3039;Substantive;e-mail address n;die E-Mail-Adresse;I must have used the wrong e-mail address.;Ich muss die falsche E-Mail-Adresse verwendet haben.;;;;;;;;;;;;;;;;;;;;;;;;
3040;Substantive;attachment n;die (E-Mail-)Anlage, der (E-Mail-)Anhang;My e-mail didn't get through because the attachment was too big.;Meine E-Mail kam nicht durch, weil die Anlage zu groß war.;;;;;;;;;;;;;;;;;;;;;;;;
3041;Adjektive und Adverbien;online adj;online;Are you going to be online later this evening?;Wirst du heute am späteren Abend online sein?;;;;;;;;;;;;;;;;;;;;;;;;
3042;Adjektive und Adverbien;offline adj;offline;I tried to reach you, but your computer was offline.;Ich wollte dich erreichen, aber dein Computer war offline.;;;;;;;;;;;;;;;;;;;;;;;;
3043;Verben;download v;(Daten) herunterladen;Is it safe to download the free version?;Ist es ungefährlich, die kostenlose Version herunterzuladen?;;;;;;;;;;;;;;;;;;;;;;;;
3044;Sonstige;to answer the phone;abnehmen, ans Telefon gehen;Could you answer the phone while I'm in the shower?;Könntest du ans Telefon gehen, während ich unter der Dusche bin?;;;;;;;;;;;;;;;;;;;;;;;;
3045;Sonstige;to hang up;auflegen;All of a sudden the line was dead. So I hung up.;Plötzlich war die Leitung tot. Also habe ich aufgelegt.;Don't hang up - I'll put you through.;Legen Sie nicht auf - ich verbinde Sie.;;;;;;;;;;;;;;;;;;;;;;
3046;Sonstige;to put sb. through;j-n durchstellen;Could you put me through to the hotel manager, please?;Könnten Sie mich bitte zum Hotelmanager durchstellen?;;;;;;;;;;;;;;;;;;;;;;;;
3047;Substantive;phone book n;das Telefonbuch;David's number is in the phone book.;Davids Nummer steht im Telefonbuch.;The number is in the phone book.;Die Nummer ist im Telefonbuch.;;;;;;;;;;;;;;;;;;;;;;
3048;Substantive;long-distance call n;das Ferngespräch;There's a long-distance call from Chicago for you.;Da ist ein Ferngespräch aus Chicago für dich.;I have to pay for three long-distance calls.;Ich muss drei Ferngespräche bezahlen.;;;;;;;;;;;;;;;;;;;;;;
3049;Substantive;local call n;das Ortsgespräch;Local calls used to be free of charge.;Ortsgespräche waren früher kostenlos.;In the USA local calls are often free of charge.;In den USA sind Ortsgespräche oft gebührenfrei.;From here you can only make local calls.;Von hier können Sie nur Ortsgespräche führen.;;;;;;;;;;;;;;;;;;;;
3050;Substantive;extension n;die Durchwahl;Call the switchboard and ask for his extension.;Ruf die Zentrale an und frag nach seiner Durchwahl.;;;;;;;;;;;;;;;;;;;;;;;;
3051;Substantive;phone card n;die Telefonkarte;Lisa had to buy a phone card.;Lisa musste sich eine Telefonkarte kaufen.;He collects phonecards.;Er sammelt Telefonkarten.;;;;;;;;;;;;;;;;;;;;;;
3052;Substantive;phone box n BE;die Telefonzelle BE;Is there a phone box near here?;Gibt es hier in der Nähe eine Telefonzelle?;I have to call my office - is there a phone box near here?;Ich muss mein Büro anrufen - gibt es hier in der Nähe eine Telefonzelle?;;;;;;;;;;;;;;;;;;;;;;
3053;Substantive;phone booth n AE;die Telefonzelle AE;It's hard to find a phone booth in this area.;In dieser Gegend ist es schwer, eine Telefonzelle zu finden.;;;;;;;;;;;;;;;;;;;;;;;;
3054;Substantive;public phone n;das öffentliche Telefon;Public phones are difficult to find these days.;Öffentliche Telefone sind heutzutage schwer zu finden.;;;;;;;;;;;;;;;;;;;;;;;;
3055;Substantive;text (message) n;die SMS;Send me a text message when you know what time the film starts.;Schick mir eine SMS, wenn du weißt, wann der Film anfängt.;;;;;;;;;;;;;;;;;;;;;;;;
3056;Verben;text v;eine SMS schreiben;I texted him about where to meet.;Ich habe ihm eine SMS geschrieben, wo wir uns treffen.;;;;;;;;;;;;;;;;;;;;;;;;
3057;Substantive;website n;der Internetauftritt;They've got a website with lots of information.;Sie haben einen Internetauftritt mit vielen Informationen.;;;;;;;;;;;;;;;;;;;;;;;;
3058;Substantive;webpage n;die Webseite;Their website seems to have a million webpages.;Ihr Internetauftritt scheint eine Million Webseiten zu haben.;;;;;;;;;;;;;;;;;;;;;;;;
3059;Substantive;homepage n;die Homepage;You'll find all the links on the homepage of our website.;Sie finden alle Links auf der Homepage unseres Internetauftritts.;;;;;;;;;;;;;;;;;;;;;;;;
3060;Substantive;link n;der Link;I'll send you an e-mail with links for online dictionaries.;Ich schicke dir eine E-Mail mit Links von Onlinewörterbüchern.;;;;;;;;;;;;;;;;;;;;;;;;
3061;Verben;surf v;surfen;Brenda just surfed the Net for a while.;Brenda hat nur ein bisschen im Netz gesurft.;;;;;;;;;;;;;;;;;;;;;;;;
3062;Substantive;server n;der Server;"I can't read the e-mail; the server is down.";"Ich kann die E-Mail nicht lesen; der Server ist nicht verfügbar.";;;;;;;;;;;;;;;;;;;;;;;;
3063;Substantive;browser n;der Browser;You should download the update for your browser.;Du solltest das Update für deinen Browser herunterladen.;;;;;;;;;;;;;;;;;;;;;;;;
3064;Substantive;computer n;der Computer;An office without a computer is almost unthinkable today.;Heute ist ein Büro ohne Computer nahezu undenkbar.;We have a new computer in our office.;Wir haben einen neuen Computer in unserem Büro.;My new computer is very powerful.;Mein neuer Computer ist sehr leistungsfähig.;;;;;;;;;;;;;;;;;;;;
3065;Substantive;hardware n;die Hardware;I need to buy some new hardware. My PC is totally outdated.;Ich muss mir neue Hardware kaufen. Mein PC ist völlig veraltet.;Computer hardware, such as monitors and printers, has become cheaper.;Die Computer-Hardware, wie z.B. Monitore und Drucker, ist billiger geworden.;;;;;;;;;;;;;;;;;;;;;;
3066;Substantive;software n;die Software;They offer software, for example this text processing program.;Sie bieten Software an, z.B. dieses Textverarbeitungsprogramm.;They offer excellent software - for example a new word processing program.;Sie bieten ausgezeichnete Software an, z.B. ein neues Textverarbeitungsprogramm.;;;;;;;;;;;;;;;;;;;;;;
3067;Verben;program v;programmieren;Kev programmed the computer to download new updates.;Kev hat den Computer programmiert, neue Updates herunterzuladen.;;;;;;;;;;;;;;;;;;;;;;;;
3068;Substantive;hard disk n;die Festplatte;I need an external hard disk to store my songs on.;Ich brauche eine externe Festplatte, um meine Songs zu speichern.;The computer virus erased all the data on the hard disk.;Der Computervirus löschte alle Daten auf der Festplatte.;;;;;;;;;;;;;;;;;;;;;;
3069;Substantive;printer n;der Drucker;Mike printed out the document on his new printer.;Mike druckte das Dokument auf seinem neuen Drucker aus.;Our new printer prints in colour.;Unser neuer Drucker druckt in Farbe.;;;;;;;;;;;;;;;;;;;;;;
3070;Substantive;keyboard n;die Tastatur;What's the difference between German and English keyboards?;Wie unterscheiden sich deutsche und englische Tastaturen?;This is a German keyboard.;Dies ist eine deutsche Tastatur.;;;;;;;;;;;;;;;;;;;;;;
3071;Substantive;cursor n;der Mauszeiger, der Cursor;The cursor on your mouse doesn't work properly.;Der Mauszeiger deiner Maus funktioniert nicht richtig.;;;;;;;;;;;;;;;;;;;;;;;;
3072;Verben;click v;klicken;Just click on this icon and download the program.;Klicken Sie auf dieses Symbol und laden Sie das Programm herunter.;;;;;;;;;;;;;;;;;;;;;;;;
3073;Sonstige;to print out;ausdrucken;Could you print out this document for me?;Könntest du dieses Dokument für mich ausdrucken?;;;;;;;;;;;;;;;;;;;;;;;;
3074;Substantive;CD-ROM n;die CD-ROM;Do you still use CD-ROMs to save your files on?;Verwendest du immer noch CD-ROMs, um deine Dateien abzuspeichern?;;;;;;;;;;;;;;;;;;;;;;;;
3075;Substantive;drive n;das Laufwerk;Is it necessary to buy an external drive for playing games?;Muss man ein externes Laufwerk kaufen, um Spiele zu spielen?;;;;;;;;;;;;;;;;;;;;;;;;
3076;Adjektive und Adverbien;digital adj;digital;Digital recordings are okay, but records have charm.;Digitale Aufnahmen sind okay, aber Schallplatten haben Charme.;;;;;;;;;;;;;;;;;;;;;;;;
3077;Substantive;data n pl;die Daten;The keyboard is used to enter data onto the computer.;Die Tastatur verwendet man, um Daten in den Computer einzugeben.;;;;;;;;;;;;;;;;;;;;;;;;
3078;Verben;paste v;einfügen;Why don't you paste a map of the region into the invitation?;Warum fügst du nicht eine Karte der Region in die Einladung ein?;;;;;;;;;;;;;;;;;;;;;;;;
3079;Verben;delete v;löschen;Oh no, I actually deleted the whole file!;Ach nein, ich habe gerade die ganze Datei gelöscht!;;;;;;;;;;;;;;;;;;;;;;;;
3080;Substantive;DVD n;die DVD;Let's get a film out on DVD, shall we?;Lass uns doch einen Film auf DVD ausleihen.;;;;;;;;;;;;;;;;;;;;;;;;
3081;Substantive;DVD player n;der DVD-Player;He doesn't have a DVD-player. He watches DVDs on his playstation.;Er hat keinen DVD-Player. Er schaut DVDs über seine Playstation.;;;;;;;;;;;;;;;;;;;;;;;;
3082;Verben;record v;aufnehmen;I asked a good friend to record the match.;Ich habe einen guten Freund gebeten, das Spiel aufzunehmen.;;;;;;;;;;;;;;;;;;;;;;;;
3083;Substantive;laptop n;der Laptop;David enjoys sitting in a café, working on his laptop.;David sitzt gern in einem Café und arbeitet an seinem Laptop.;;;;;;;;;;;;;;;;;;;;;;;;
3084;Verben;scan v;(ein)scannen;You'll have to scan your medical certificate.;Du wirst dein Attest scannen müssen.;;;;;;;;;;;;;;;;;;;;;;;;
3085;Substantive;operating system n;das Betriebssystem;The new operating system makes this task easier.;Das neue Betriebssystem vereinfacht diese Aufgabe.;;;;;;;;;;;;;;;;;;;;;;;;
3086;Verben;install v;installieren;Could you help me install this game, please?;Könntest du mir bitte helfen, dieses Spiel zu installieren?;;;;;;;;;;;;;;;;;;;;;;;;
3087;Substantive;database n;die Datenbank;Our database contains 50,000 names and addresses of customers.;Unsere Datenbank enthält 50.000 Namen und Adressen von Kunden.;;;;;;;;;;;;;;;;;;;;;;;;
3088;Substantive;backup (copy) n;die Sicherheitskopie;Make sure you always make a backup copy of important documents.;Mach immer eine Sicherheitskopie von wichtigen Dokumenten!;;;;;;;;;;;;;;;;;;;;;;;;
3089;Substantive;folder n;der Ordner;Caitlin created a folder and put it on the desktop.;Caitlin hat einen Ordner angelegt und auf dem Desktop abgelegt.;;;;;;;;;;;;;;;;;;;;;;;;
3090;Substantive;computer virus n;der Computervirus;I activated a computer virus when I opened the attachment.;Ich aktivierte einen Computervirus, als ich den Anhang öffnete.;;;;;;;;;;;;;;;;;;;;;;;;
3091;Substantive;password n;das Passwort;Your password should include letters and numbers.;Dein Passwort sollte Buchstaben und Zahlen enthalten.;;;;;;;;;;;;;;;;;;;;;;;;
3092;Verben;zip v;komprimieren;If you zip this file, it'll be much smaller.;Wenn du diese Datei komprimierst, wird sie viel kleiner sein.;;;;;;;;;;;;;;;;;;;;;;;;
3093;Adjektive und Adverbien;multimedia adj;Multimedia-, multimedial;Why aren't multimedia computers more successful on the market?;Warum haben Multimediacomputer nicht mehr Erfolg auf dem Markt?;The boss is working on his multimedia presentation.;Der Chef arbeitet an seiner multimedialen Präsentation.;;;;;;;;;;;;;;;;;;;;;;
3094;Substantive;computer game n;das Computerspiel;Joe likes computer games even though they take up a lot of time.;Joe mag Computerspiele, obwohl sie viel Zeit beanspruchen.;;;;;;;;;;;;;;;;;;;;;;;;
3095;Adjektive und Adverbien;interactive adj;interaktiv;Tim was playing an interactive online computer game with friends.;Tim spielte ein interaktives Online-Computerspiel mit Freunden.;;;;;;;;;;;;;;;;;;;;;;;;
3096;Adjektive und Adverbien;virtual adj;virtuell;My son seems to live in his own virtual world.;Mein Sohn scheint in seiner eigenen virtuellen Welt zu leben.;;;;;;;;;;;;;;;;;;;;;;;;
3097;Substantive;economy n;die Wirtschaft;What can be done when the economy is on a downturn?;Was ist zu tun, wenn sich die Wirtschaft im Abschwung befindet?;High interest rates are bad for a country's economy.;Hohe Zinssätze sind für die Wirtschaft eines Landes schlecht.;;;;;;;;;;;;;;;;;;;;;;
3098;Substantive;firm n;die Firma, der Betrieb;Terry's worked for 30 years at the same firm.;Terry arbeitet seit 30 Jahren bei derselben Firma.;He belongs to our firm.;Er gehört zu unserer Firma.;;;;;;;;;;;;;;;;;;;;;;
3099;Substantive;public limited company n BE;die Aktiengesellschaft BE;The company went public, and now it's a public limited company.;Die Firma ging an die Börse und ist nun eine Aktiengesellschaft.;;;;;;;;;;;;;;;;;;;;;;;;
3100;Substantive;corporation n AE;die Aktiengesellschaft AE;A corporation issues stocks on the stock exchange.;Eine Aktiengesellschaft gibt an der Börse Aktien aus.;;;;;;;;;;;;;;;;;;;;;;;;
3101;Substantive;industry n;die Industrie;The car industry has been hard hit by the recession.;Die Autoindustrie ist von der Rezession schwer betroffen.;He has an important position in the steel industry.;Er hat eine wichtige Stellung in der Stahlindustrie.;;;;;;;;;;;;;;;;;;;;;;
3102;Sonstige;to do business;Geschäfte machen;We do a lot of business with companies in Japan.;Wir machen viele Geschäfte mit Firmen in Japan.;;;;;;;;;;;;;;;;;;;;;;;;
3103;Substantive;(line of) business n;die Branche;James started working in a different line of business.;James fing an, in einer anderen Branche zu arbeiten.;;;;;;;;;;;;;;;;;;;;;;;;
3104;Substantive;merchandise n;die Ware;All the merchandise imported from China was checked.;Alle Waren aus China wurden überprüft.;;;;;;;;;;;;;;;;;;;;;;;;
3105;Substantive;goods n pl;die Ware, die Güter;Some of the goods that arrived yesterday were damaged.;Einige der Waren, die gestern angekommen sind, waren beschädigt.;Have the goods arrived?;Sind die Waren angekommen?;;;;;;;;;;;;;;;;;;;;;;
3106;Substantive;turnover n;der Umsatz;Our company has a turnover of 200,000 euros.;Unsere Firma macht einen Umsatz von 200.000 Euro.;;;;;;;;;;;;;;;;;;;;;;;;
3107;Verben;export v;exportieren, ausführen;Germany exports much more than it imports.;Deutschland exportiert viel mehr als es importiert.;Switzerland rarely exports its wines.;Die Schweiz exportiert ihre Weine selten.;;;;;;;;;;;;;;;;;;;;;;
3108;Verben;import v;einführen, importieren;Bulgaria imports most of its natural gas from Russia.;Bulgarien führt sein Erdgas zum größten Teil aus Russland ein.;We import wines from France and Italy.;Wir importieren Weine aus Frankreich und Italien.;;;;;;;;;;;;;;;;;;;;;;
3109;Substantive;workshop n;die Werkstatt;Mr Jones has a small workshop where he repairs clocks.;Mr Jones hat eine kleine Werkstatt, in der er Uhren repariert.;The television will have to be taken to the workshop for repair.;Der Fernseher muss zum Reparieren in die Werkstatt (gebracht werden).;;;;;;;;;;;;;;;;;;;;;;
3110;Verben;repair v;reparieren;We must have the car repaired.;Wir müssen das Auto reparieren lassen.;Can you repair my bicycle?;Können Sie mein Fahrrad reparieren?;;;;;;;;;;;;;;;;;;;;;;
3111;Substantive;agency n;die Agentur;Jon works for an agency that specializes in advertising.;Jon arbeitet für eine Agentur, die auf Werbung spezialisiert ist.;;;;;;;;;;;;;;;;;;;;;;;;
3112;Substantive;company n;das Unternehmen;The government is bailing out companies.;Die Regierung hilft Unternehmen finanziell aus der Klemme.;We kept the boy company when he was ill.;Wir leisteten dem Jungen Gesellschaft, als er krank war.;;;;;;;;;;;;;;;;;;;;;;
3113;Adjektive und Adverbien;industrial adj;industriell;The steam engine started the first industrial revolution.;Mit der Dampfmaschine begann die erste industrielle Revolution.;Germany and England are industrial countries.;Deutschland und England sind Industrieländer.;;;;;;;;;;;;;;;;;;;;;;
3114;Substantive;manufacturer n;der Hersteller, die Herstellerin;The French manufacturer of these goods has gone bankrupt.;Der französische Hersteller dieser Güter hat Bankrott gemacht.;;;;;;;;;;;;;;;;;;;;;;;;
3115;Verben;manufacture v;herstellen;They've been manufacturing women's hats for more than 150 years.;Seit über 150 Jahren stellen sie Damenhüte her.;;;;;;;;;;;;;;;;;;;;;;;;
3116;Substantive;product n;das Produkt, das Erzeugnis;New Zealand's main products are wool and meat.;Neuseelands wichtigste Erzeugnisse sind Wolle und Fleisch.;The chief products of the country are ...;Die Hauptprodukte des Landes sind...;;;;;;;;;;;;;;;;;;;;;;
3117;Substantive;production n;die Herstellung, die Produktion;The company has moved the production of all parts to Vietnam.;Die Firma hat die Herstellung aller Teile nach Vietnam verlagert.;Car production is no longer increasing.;Die Autoproduktion steigert sich nicht mehr.;;;;;;;;;;;;;;;;;;;;;;
3118;Verben;produce v;herstellen, produzieren;Henry Ford produced his Model T from 1909 to 1927.;Henry Ford stellte sein Model T von 1909 bis 1927 her.;Italy and France produce famous wines.;Italien und Frankreich erzeugen berühmte Weine.;;;;;;;;;;;;;;;;;;;;;;
3119;Substantive;trade n;der Handel;The value of the dollar is important for trade with the US.;Der Wert des Dollars ist wichtig für den Handel mit den USA.;Their trade with foreign countries has increased.;Ihr Handel mit dem Ausland hat zugenommen.;;;;;;;;;;;;;;;;;;;;;;
3120;Verben;supply v;versorgen, beliefern;Scandinavia supplies the furniture industry with wood.;Skandinavien beliefert die Möbelindustrie mit Holz.;Their firm supplies the oil for our heating.;Ihre Firma liefert das Öl für unsere Heizung.;They supply us with food and other things.;Sie liefern uns Lebensmittel und andere Dinge (= beliefern uns mit ...).;;;;;;;;;;;;;;;;;;;;
3121;Substantive;marketing n;das Marketing;Marketing involves the advertising of a product.;Das Marketing dreht sich um die Bewerbung eines Produkts.;;;;;;;;;;;;;;;;;;;;;;;;
3122;Substantive;advert n BE;die Anzeige BE;Please don't throw away the issue with all the adverts.;Bitte wirf die Ausgabe mit all den Anzeigen nicht weg.;;;;;;;;;;;;;;;;;;;;;;;;
3123;Substantive;ad n AE;die Anzeige AE;I put an ad in a magazine.;Ich habe eine Anzeige in einer Zeitschrift geschaltet.;;;;;;;;;;;;;;;;;;;;;;;;
3124;Substantive;advertisement n;die Anzeige;There's an advertisement in the paper.;Da ist eine Anzeige in der Zeitung.;We put an advertisement in the newspaper.;Wir setzten eine Anzeige in die Zeitung.;;;;;;;;;;;;;;;;;;;;;;
3125;Sonstige;to advertise sth.;für etw. Werbung machen;The new car model is being advertised in all the media.;Für das neue Automodell wird in allen Medien Werbung gemacht.;;;;;;;;;;;;;;;;;;;;;;;;
3126;Substantive;consumer n;der Verbraucher, die Verbraucherin;Consumers cut their spending in a recession.;In einer Rezession schränken die Verbraucher ihre Ausgaben ein.;;;;;;;;;;;;;;;;;;;;;;;;
3127;Substantive;consumer society n;die Konsumgesellschaft;Our consumer society depends on new needs.;Unsere Konsumgesellschaft ist auf neue Bedürfnisse angewiesen.;;;;;;;;;;;;;;;;;;;;;;;;
3128;Substantive;economic growth n;das Wirtschaftswachstum;The industrialized nations want to promote economic growth.;Die Industrienationen wollen das Wirtschaftswachstum fördern.;;;;;;;;;;;;;;;;;;;;;;;;
3129;Substantive;globalization n;die Globalisierung;Will regional characteristics survive globalization?;Werden regionale Eigenarten die Globalisierung überleben?;;;;;;;;;;;;;;;;;;;;;;;;
3130;Substantive;money n;das Geld;A college education costs a lot of money in the US.;In den USA kostet eine Hochschulausbildung viel Geld.;Do you want to make a lot of money?;Willst du viel Geld verdienen?;;;;;;;;;;;;;;;;;;;;;;
3131;Substantive;cash n;das Bargeld;They don't accept cheques. You'll have to take some cash.;Sie akzeptieren keine Schecks. Sie müssen Bargeld mitnehmen.;He had no cash on him.;Er hatte kein Bargeld bei sich.;;;;;;;;;;;;;;;;;;;;;;
3132;Adjektive und Adverbien;financial adj;finanziell;The company is in deep financial trouble.;Die Firma steckt tief in finanziellen Problemen.;;;;;;;;;;;;;;;;;;;;;;;;
3133;Substantive;cheque card n BE;die Scheckkarte BE;He is informing the bank that he's lost his cheque card.;Er informiert die Bank, dass er seine Scheckkarte verloren hat.;;;;;;;;;;;;;;;;;;;;;;;;
3134;Substantive;check card n AE;die Scheckkarte AE;;;;;;;;;;;;;;;;;;;;;;;;;;
