1;Substantive;Mr n;der Herr;This is my boss, Mr Paul Brown.;Das ist mein Chef, Herr Paul Brown.;;;;;;;;;;;;;;;;;;;;;;;;
2;Substantive;man n;der Mann;He's a good-looking man.;Er ist ein gut aussehender Mann.;A man took her bag away.;Ein Mann nahm ihre Tasche weg.;All men must die.;Alle Menschen müssen sterben.;No man can do this.;Kein Mensch kann das tun.;;;;;;;;;;;;;;;;;;
3;Substantive;Mrs n;die Frau;Is there a Mrs Bolton living in this house?;Wohnt in diesem Haus eine Frau Bolton?;Do you know a Mrs Moss?;Kennen sie eine Frau Moss?;Hello, Mrs White!;Guten Tag, Frau White!;;;;;;;;;;;;;;;;;;;;
4;Substantive;woman n;die Frau;"The novel is called ""A Woman of Thirty"".";"Der Roman heißt ""Eine Frau von dreißig Jahren"".";A young woman came in.;Eine junge Frau kam herein.;;;;;;;;;;;;;;;;;;;;;;
5;Substantive;Ms n;die Frau;Do you need any help, Ms Carlton?;Brauchen Sie Hilfe, Frau Carlton?;Ms Mary Doolittle.;Frau Mary Doolittle.;;;;;;;;;;;;;;;;;;;;;;
6;Substantive;baby n;das Baby;Peter is seven years old, Anne is still a baby.;Peter ist sieben Jahre alt, Anne ist noch ein Baby.;The baby is learning to speak.;Das Baby lernt sprechen.;;;;;;;;;;;;;;;;;;;;;;
7;Substantive;child n;das Kind;We're expecting our third child in June.;Im Juni erwarten wir unser drittes Kind.;They have two children.;Sie haben zwei Kinder.;;;;;;;;;;;;;;;;;;;;;;
8;Substantive;boy n;der Junge;There are only three boys in our class.;In unserer Klasse sind nur drei Jungen.;Roger is a clever boy.;Roger ist ein kluger Junge.;;;;;;;;;;;;;;;;;;;;;;
9;Substantive;girl n;das Mädchen;Both my girls play in the same baseball team.;Meine beiden Mädchen spielen im selben Baseballteam.;She went for a walk with the girls.;Sie ging mit den Mädchen spazieren.;;;;;;;;;;;;;;;;;;;;;;
10;Verben;call v;nennen, rufen, anrufen;His name is Robert, but we call him Rob.;Sein Name ist Robert, aber wir nennen ihn Rob.;Martin called his name but he didn't hear him.;Martin rief ihn, aber er hörte ihn nicht.;I've been trying to call you all morning.;Ich versuche schon den ganzen Morgen, Sie anzurufen.;Let's call him Billy!;Nennen wir ihn Billy!;Has anybody called?;Hat jemand angerufen?;;;;;;;;;;;;;;;;
11;Sonstige;to be called;heißen;He's called Mario.;Er heißt Mario.;The girl is called Angela.;Das Mädchen heißt Angela.;;;;;;;;;;;;;;;;;;;;;;
12;Substantive;name n;der Name;Could you spell your name, please?;Könnten Sie bitte Ihren Namen buchstabieren?;What's his name?;Wie ist sein Name?;;;;;;;;;;;;;;;;;;;;;;
13;Substantive;surname n;der Familienname;What's your mother's surname?;Wie ist der Familienname deiner Mutter?;What's your surname?;Wie ist Ihr Familienname?;;;;;;;;;;;;;;;;;;;;;;
14;Substantive;last name n;der Nachname;What's your mother's last name?;Wie ist der Nachname deiner Mutter?;;;;;;;;;;;;;;;;;;;;;;;;
15;Substantive;first name n;der Vorname;My first name is Swedish.;Mein Vorname ist schwedisch.;What's your first name?;Wie heißen Sie mit Vornamen?;;;;;;;;;;;;;;;;;;;;;;
16;Adjektive und Adverbien;single adj;ledig;I'm not single. My husband lives in Mexico.;Ich bin nicht ledig. Mein Mann lebt in Mexiko.;She's a single woman.;Sie ist ledig (= eine ledige Frau).;They had no single rooms vacant at the hotel.;Sie hatten im Hotel keine Einzelzimmer frei.;Here's a single stocking.;Hier ist ein einzelner Strumpf.;;;;;;;;;;;;;;;;;;
17;Substantive;singles n pl;die Singles;I was at a party with lots of singles.;Ich war bei einer Party mit lauter Singles.;;;;;;;;;;;;;;;;;;;;;;;;
18;Adjektive und Adverbien;married adj;verheiratet;Since when have you been married?;Seit wann sind Sie verheiratet?;She is a married woman.;Sie ist eine verheiratete Frau.;;;;;;;;;;;;;;;;;;;;;;
19;Adjektive und Adverbien;divorced adj;geschieden;James and Carol were married. Now they're divorced.;James und Carol waren verheiratet. Jetzt sind sie geschieden.;;;;;;;;;;;;;;;;;;;;;;;;
20;Adjektive und Adverbien;separated adj;getrennt;Their parents are separated and live in different flats.;Ihre Eltern sind getrennt und leben in verschiedenen Wohnungen.;;;;;;;;;;;;;;;;;;;;;;;;
21;Substantive;widower n;der Witwer;Peter's wife died young. He's been a widower most of his life.;Peters Frau starb jung. Er ist fast sein Leben lang Witwer.;;;;;;;;;;;;;;;;;;;;;;;;
22;Substantive;widow n;die Witwe;After her husband's death she founded a forum for widows.;Nach dem Tod ihres Gatten gründete sie ein Forum für Witwen.;Mr Miller left a large sum to his widow.;Herr Miller hinterließ seiner Witwe eine große Geldsumme.;;;;;;;;;;;;;;;;;;;;;;
23;Adjektive und Adverbien;widowed adj;verwitwet;He has been widowed for many years.;Er ist seit vielen Jahren verwitwet.;;;;;;;;;;;;;;;;;;;;;;;;
24;Sonstige;to come from;herkommen;Where do you come from?;Wo kommen Sie her?;;;;;;;;;;;;;;;;;;;;;;;;
25;Sonstige;to be from;kommen aus;She's from Toronto, Canada.;Sie kommt aus Toronto, Kanada.;;;;;;;;;;;;;;;;;;;;;;;;
26;Substantive;(place of) residence n;der Wohnort, der Wohnsitz;What's your permanent place of residence?;Was ist Ihr ständiger Wohnort?;;;;;;;;;;;;;;;;;;;;;;;;
27;Substantive;address n;die Adresse, die Anschrift;What's your address?;Wie ist Ihre Adresse?;;;;;;;;;;;;;;;;;;;;;;;;
28;Substantive;street n;die Straße;She lives at 735 Willard Street.;Sie wohnt in der Willard-Straße 735.;We strolled through the narrow streets of the old town.;Wir bummelten durch die schmalen Straßen der Altstadt.;Do you live in this street?;Wohnst du in dieser Straße?;;;;;;;;;;;;;;;;;;;;
29;Substantive;house number n;die Hausnummer;No, the house number is 24, not 34.;Nein, die Hausnummer ist 24, nicht 34.;;;;;;;;;;;;;;;;;;;;;;;;
30;Substantive;telephone number n;die Telefonnummer;His office has a new telephone number: it's 894-7866.;Sein Büro hat eine neue Telefonnummer: Sie lautet 894-7866.;;;;;;;;;;;;;;;;;;;;;;;;
31;Substantive;person n;die Person;Tickets for the game are $24 per person.;Die Eintrittskarten für das Spiel kosten 24 Dollar pro Person.;She is such a nice person.;Sie ist so eine nette Person.;;;;;;;;;;;;;;;;;;;;;;
32;Substantive;marital status n;der Familienstand;Why did they ask for your marital status?;Warum haben sie nach deinem Familienstand gefragt?;;;;;;;;;;;;;;;;;;;;;;;;
33;Substantive;gender n;das Geschlecht;Nobody should be discriminated against because of their gender.;Niemand sollte wegen seines Geschlechts benachteiligt werden.;;;;;;;;;;;;;;;;;;;;;;;;
34;Substantive;nationality n;die Staatsangehörigkeit, die Staatsbürgerschaft, die Nationalität;People of many different nationalities live there.;Da leben Menschen mit vielen verschiedenen Staatsangehörigkeiten.;In London you can see people of different nationalities.;In London kann man Menschen verschiedener Nationalität sehen.;In London you can see people of many different nationalities.;In London kann man Menschen vieler verschiedener Nationalitäten sehen.;;;;;;;;;;;;;;;;;;;;
35;Substantive;citizen n;der Staatsbürger, die Staatsbürgerin, der Bürger, die Bürgerin;He is an American citizen because he was born there.;Er ist amerikanischer Staatsbürger, weil er dort geboren ist.;He married and became a US citizen.;Er heiratete und wurde amerikanischer Staatsbürger.;Is he a citizen of the USA?;Ist er ein Bürger der USA?;;;;;;;;;;;;;;;;;;;;
36;Sonstige;of age;volljährig;I look younger but I am of age.;Ich sehe jünger aus, aber ich bin schon volljährig.;;;;;;;;;;;;;;;;;;;;;;;;
37;Sonstige;under age;minderjährig;They didn't let her in. She's still under age.;Sie haben sie nicht reingelassen. Sie ist noch minderjährig.;;;;;;;;;;;;;;;;;;;;;;;;
38;Substantive;nickname n;der Spitzname;My nickname is Speedy.;Mein Spitzname ist Speedy.;;;;;;;;;;;;;;;;;;;;;;;;
39;Adjektive und Adverbien;good adj;gut, lieb, brav;Greg's a really good cook.;Greg ist ein wirklich guter Koch.;Be a good boy and play outside in the garden.;Sei ein braver Junge und spiele draußen im Garten.;Mario speaks good English.;Mario spricht gutes Englisch.;He likes a good meal.;Er hat gern(e) ein gutes Essen.;;;;;;;;;;;;;;;;;;
40;Adjektive und Adverbien;kind adj;nett;It was very kind of you to help me.;Es war sehr nett von dir, mir zu helfen.;;;;;;;;;;;;;;;;;;;;;;;;
41;Adjektive und Adverbien;friendly adj;freundlich, freundschaftlich;Amanda greeted us with a friendly smile.;Amanda begrüßte uns mit einem freundlichen Lächeln.;He shouldn't get too friendly with his patients.;Er sollte nicht zu freundschaftlich mit seinen Patienten umgehen.;She's always friendly and tries to help others.;Sie ist immer freundlich und versucht anderen zu helfen.;;;;;;;;;;;;;;;;;;;;
42;Adjektive und Adverbien;unfriendly adj;unfreundlich;The receptionist was quite unfriendly.;Die Empfangsdame war ziemlich unfreundlich.;;;;;;;;;;;;;;;;;;;;;;;;
43;Substantive;patience n;die Geduld;And then he lost his patience and became angry.;Und dann hat er die Geduld verloren und wurde böse.;A teacher must have patience with the slower students.;Ein Lehrer muss mit den langsameren Schülern Geduld haben.;;;;;;;;;;;;;;;;;;;;;;
44;Adjektive und Adverbien;patient adj;geduldig;You should be more patient with your children.;Du solltest geduldiger mit deinen Kindern sein.;You have to be patient with children.;Man muss mit Kindern geduldig sein.;;;;;;;;;;;;;;;;;;;;;;
45;Adjektive und Adverbien;impatient adj;ungeduldig;I get impatient when people don't listen to me.;Ich werde ungeduldig, wenn mir Leute nicht zuhören.;;;;;;;;;;;;;;;;;;;;;;;;
46;Adjektive und Adverbien;careful adj;vorsichtig;Be careful crossing the street.;Sei vorsichtig, wenn du die Straße überquerst!;Be careful!;Sei vorsichtig!, Gib acht!;Eric is a careful worker.;Eric ist ein sorgfältiger Arbeiter.;;;;;;;;;;;;;;;;;;;;
47;Adjektive und Adverbien;carefully adv;aufmerksam;She always reads recipes carefully before starting to cook.;Sie liest Rezepte immer aufmerksam, bevor sie anfängt zu kochen.;;;;;;;;;;;;;;;;;;;;;;;;
48;Adjektive und Adverbien;careless adj;unvorsichtig;It was very careless of you to leave the bag.;Es war sehr unvorsichtig von dir, die Tasche liegen zu lassen.;A careless driver is a danger to the public.;Ein leichtsinniger Fahrer ist eine Gefahr für die Öffentlichkeit.;;;;;;;;;;;;;;;;;;;;;;
49;Adjektive und Adverbien;serious adj;ernst, ernsthaft;Mrs Rawlson doesn't laugh much. She's a serious person.;Mrs Rawlson lacht nicht viel. Sie ist ein ernsthafter Mensch.;There was a serious look on his face.;Er schaute ernst drein.;;;;;;;;;;;;;;;;;;;;;;
50;Adjektive und Adverbien;polite adj;höflich;It wasn't polite of Tony to keep us waiting so long.;Es war nicht höflich von Tony, uns so lange warten zu lassen.;"The English are very polite - they say ""please"" and ""thank you"" all the time.";"Die Engländer sind sehr höflich - sie sagen dauernd ""Bitte"" und ""Danke"".";;;;;;;;;;;;;;;;;;;;;;
51;Adjektive und Adverbien;impolite adj;unhöflich;Would it be very impolite to leave now?;Wäre es sehr unhöflich, jetzt zu gehen?;;;;;;;;;;;;;;;;;;;;;;;;
52;Adjektive und Adverbien;rough adj;grob, rau;Jodi's boyfriend can be quite rough.;Jodis Freund kann ziemlich grob sein.;Tweed is a rough woollen cloth.;Tweed ist ein grober Wollstoff.;;;;;;;;;;;;;;;;;;;;;;
53;Adjektive und Adverbien;pleasant adj;sympathisch, angenehm;Her boss seems a very pleasant woman.;Ihre Chefin scheint eine sehr sympathische Frau zu sein.;These roses have a very pleasant smell.;Diese Rosen haben einen sehr angenehmen Duft.;These flowers have a pleasant smell.;Diese Blumen haben einen angenehmen Duft.;;;;;;;;;;;;;;;;;;;;
54;Adjektive und Adverbien;unpleasant adj;unsympathisch, unangenehm;He sounded somewhat unpleasant on the phone.;Er klang etwas unsympathisch am Telefon.;There was an unpleasant smell in the room.;Ein unangenehmer Geruch war im Zimmer.;;;;;;;;;;;;;;;;;;;;;;
55;Adjektive und Adverbien;lazy adj;faul;You wouldn't believe how lazy I can be.;Du würdest nicht glauben, wie faul ich sein kann.;Don't be so lazy.;Sei nicht so faul.;;;;;;;;;;;;;;;;;;;;;;
56;Adjektive und Adverbien;cheerful adj;fröhlich, heiter;I'm always cheerful in the mornings.;Ich bin morgens immer fröhlich.;;;;;;;;;;;;;;;;;;;;;;;;
57;Adjektive und Adverbien;funny adj;lustig, komisch, witzig;My new boyfriend is so funny. He knows hundreds of jokes.;Mein neuer Freund ist so lustig. Er kennt Hunderte von Witzen.;Carrie's so funny that she makes everybody laugh.;Carrie ist so witzig, dass sie jeden zum Lachen bringt.;He's so funny that he makes everybody laugh.;Er ist so komisch, dass er alle zum Lachen bringt.;;;;;;;;;;;;;;;;;;;;
58;Adjektive und Adverbien;entertaining adj;unterhaltsam;His performance as Harry Potter was really entertaining.;Seine Darbietung als Harry Potter war wirklich unterhaltsam.;It isn't great literature but very entertaining.;Es ist keine große Literatur, aber sehr unterhaltsam.;;;;;;;;;;;;;;;;;;;;;;
59;Adjektive und Adverbien;calm adj;ruhig;Even though he hadn't passed the test, his father stayed calm.;Obwohl er den Test nicht bestanden hatte, blieb sein Vater ruhig.;;;;;;;;;;;;;;;;;;;;;;;;
60;Adjektive und Adverbien;clever adj;schlau;What a clever girl you are.;Was für ein schlaues Mädchen du doch bist.;He is a clever fellow.;Er ist ein cleverer Bursche.;;;;;;;;;;;;;;;;;;;;;;
61;Substantive;stupidity n;die Dummheit;His stupidity is incredible. He is asking if chickens lay eggs.;Seine Dummheit ist unglaublich. Er fragt, ob Hühner Eier legen.;;;;;;;;;;;;;;;;;;;;;;;;
62;Adjektive und Adverbien;stupid adj;dumm;There are no stupid questions, only stupid answers.;Es gibt keine dummen Fragen, sondern nur dumme Antworten.;How stupid can you be!;Wie kann man (nur) so dumm sein!;;;;;;;;;;;;;;;;;;;;;;
63;Substantive;courage n;der Mut;Don't lose courage!;Verlier den Mut nicht!;Don't you have the courage to tell him the truth?;Hast du nicht den Mut, ihm die Wahrheit zu sagen?;;;;;;;;;;;;;;;;;;;;;;
64;Adjektive und Adverbien;brave adj;mutig;It was brave of Kyle to jump into the water to save her.;Es war mutig von Kyle, ins Wasser zu springen, um sie zu retten.;Be brave - it'll only hurt for a moment.;Sei tapfer - es wird nur einen Augenblick wehtun.;;;;;;;;;;;;;;;;;;;;;;
65;Adjektive und Adverbien;cowardly adj;feige;That was a cowardly lie.;Das war eine feige Lüge.;;;;;;;;;;;;;;;;;;;;;;;;
66;Sonstige;to be used to;gewöhnt sein an;I'm used to getting up early.;Ich bin daran gewöhnt, früh aufzustehen.;He is not used to drinking.;Er ist das Trinken nicht gewohnt.;;;;;;;;;;;;;;;;;;;;;;
67;Substantive;personality n;die Persönlichkeit;You need a strong personality to work here.;Um hier zu arbeiten, braucht man eine starke Persönlichkeit.;;;;;;;;;;;;;;;;;;;;;;;;
68;Substantive;character n;der Charakter, das Zeichen;He's a man of character.;Er ist ein Mann von Charakter.;The password should have at least eight characters.;Das Passwort sollte mindestens acht Zeichen lang sein.;She is a woman of character.;Sie hat Charakter.;;;;;;;;;;;;;;;;;;;;
69;Substantive;honesty n;die Ehrlichkeit;Tyler's honesty is not in question.;Tylers Ehrlichkeit steht nicht infrage.;;;;;;;;;;;;;;;;;;;;;;;;
70;Adjektive und Adverbien;honest adj;ehrlich;I'm glad she was honest with me.;Ich bin froh, dass sie ehrlich zu mir war.;He has an honest face.;Er hat ein ehrliches Gesicht.;;;;;;;;;;;;;;;;;;;;;;
71;Adjektive und Adverbien;sincerely adv;wirklich, aufrichtig;I sincerely hope he's not ill again.;Ich hoffe aufrichtig, dass er nicht wieder krank ist.;;;;;;;;;;;;;;;;;;;;;;;;
72;Adjektive und Adverbien;open adj;offen, geöffnet;The new manager is open and friendly.;Der neue Manager ist offen und freundlich.;In Britain banks are open until 3:30 pm.;In Großbritannien sind die Banken bis 15.30 Uhr geöffnet.;The gate was open.;Das Tor war offen.;;;;;;;;;;;;;;;;;;;;
73;Adjektive und Adverbien;generous adj;großzügig;It was very generous of Matthew to pay for the dinner.;Es war sehr großzügig von Matthew, das Abendessen zu bezahlen.;You are too generous with your money.;Du bist zu großzügig mit deinem Geld.;;;;;;;;;;;;;;;;;;;;;;
74;Adjektive und Adverbien;stingy adj;geizig;Many people are too stingy to turn on the heating in winter.;Viele Menschen sind zu geizig, im Winter die Heizung anzustellen.;;;;;;;;;;;;;;;;;;;;;;;;
75;Substantive;sense of humour n BE;der Humor BE;Angela has a great sense of humour. You should meet her.;Angela hat einen tollen Humor. Du solltest sie kennenlernen.;;;;;;;;;;;;;;;;;;;;;;;;
76;Substantive;sense of humor n AE;der Humor AE;;;;;;;;;;;;;;;;;;;;;;;;;;
77;Substantive;mood n;die Laune;Don't talk to Sam, he's in a bad mood.;Sprich Sam nicht an, er hat schlechte Laune.;I'm not in the mood to go out today.;Ich bin heute nicht in der Stimmung, um auszugehen.;;;;;;;;;;;;;;;;;;;;;;
78;Substantive;curiosity n;die Neugierde;Danny read the letter out of curiosity.;Danny hat den Brief aus Neugierde gelesen.;;;;;;;;;;;;;;;;;;;;;;;;
79;Adjektive und Adverbien;curious adj;neugierig;I'm curious to know what he did.;Ich bin neugierig zu erfahren, was er getan hat.;We have very curious neighbours who are always asking questions.;Wir haben sehr neugierige Nachbarn, die dauernd Fragen stellen.;;;;;;;;;;;;;;;;;;;;;;
80;Adjektive und Adverbien;ambitious adj;ehrgeizig;Annabel is an ambitious young woman with clear career objectives.;Annabel ist eine ehrgeizige junge Frau mit klaren Karrierezielen.;;;;;;;;;;;;;;;;;;;;;;;;
81;Substantive;passion n;die Leidenschaft;My brother has a passion for good food.;Mein Bruder hat eine Leidenschaft für gutes Essen.;;;;;;;;;;;;;;;;;;;;;;;;
82;Adjektive und Adverbien;passionate adj;leidenschaftlich;They had a short but passionate affair.;Sie hatten eine kurze, aber leidenschaftliche Affäre.;;;;;;;;;;;;;;;;;;;;;;;;
83;Adjektive und Adverbien;naughty adj;ungezogen;Her children are so naughty at times.;Ihre Kinder sind manchmal so ungezogen.;;;;;;;;;;;;;;;;;;;;;;;;
84;Adjektive und Adverbien;sensitive adj;empfindlich, sensibel;He is making fun of Katie and she's very sensitive.;Er macht sich über Katie lustig, und sie ist sehr sensibel.;Don't be rude to her - she's a very sensitive child.;Sei nicht grob zu ihr - sie ist ein sehr sensibles Kind.;;;;;;;;;;;;;;;;;;;;;;
85;Adjektive und Adverbien;nervous adj;nervös;Go away! You're making me nervous.;Geh weg! Du machst mich nervös.;Big dogs make her nervous.;Große Hunde machen sie nervös.;;;;;;;;;;;;;;;;;;;;;;
86;Adjektive und Adverbien;shy adj;schüchtern;I'd like to go out with Jenny, but I'm too shy.;Ich möchte mit Jenny ausgehen, aber ich bin zu schüchtern.;The girl gave us a shy smile.;Das Mädchen lächelte uns scheu an.;;;;;;;;;;;;;;;;;;;;;;
87;Adjektive und Adverbien;modest adj;bescheiden;Although he is successful, he's always remained modest.;Obwohl er erfolgreich ist, ist er immer bescheiden geblieben.;;;;;;;;;;;;;;;;;;;;;;;;
88;Adjektive und Adverbien;mad adj;verrückt, wütend;Hannah must be mad to spend so much money on CDs.;Hannah muss verrückt sein, so viel Geld für CDs auszugeben.;Margret is mad because I lost her necklace.;Margret ist wütend, weil ich ihr Halsband verloren habe.;She gets mad at me for coming home late.;Sie wird böse auf mich, wenn ich (zu) spät nach Hause komme.;;;;;;;;;;;;;;;;;;;;
89;Adjektive und Adverbien;ridiculous adj;lächerlich;Don't be ridiculous!;Mach dich nicht lächerlich!;;;;;;;;;;;;;;;;;;;;;;;;
90;Substantive;reason n;die Vernunft, der Verstand, der Grund;Reason is the ability to think in an intelligent way.;Die Vernunft ist die Fähigkeit, auf intelligente Weise zu denken.;Human beings are able to apply the power of reason.;Menschen können ihren Verstand gebrauchen.;I understand your reasons, but you should apologize.;Ich verstehe deine Gründe, aber du solltest dich entschuldigen.;That brought him to reason.;Das brachte ihn zur Vernunft.;What is the reason for his behaviour?;Was ist der Grund für sein Benehmen?;;;;;;;;;;;;;;;;
91;Adjektive und Adverbien;reasonable adj;vernünftig;Be reasonable! It's too expensive.;Sei vernünftig! Es ist zu teuer.;What they said sounded reasonable.;Was sie sagten, klang vernünftig.;;;;;;;;;;;;;;;;;;;;;;
92;Substantive;pride n;der Stolz;She hurt my pride when she said I was ugly.;Sie hat meinen Stolz verletzt, als sie sagte, ich sei hässlich.;Her pride prevented her from accepting the money.;Ihr Stolz hinderte sie daran, das Geld anzunehmen.;;;;;;;;;;;;;;;;;;;;;;
93;Adjektive und Adverbien;proud adj;stolz;The little girl was so proud of her new doll.;Das kleine Mädchen war so stolz auf ihre neue Puppe.;The woman was proud of her sons.;Die Frau war stolz auf ihre Söhne.;;;;;;;;;;;;;;;;;;;;;;
94;Substantive;face n;das Gesicht;Albert had a big smile on his face when he saw me.;Albert lachte übers ganze Gesicht, als er mich sah.;She could not look me in the face.;Sie konnte mir nicht ins Gesicht sehen.;;;;;;;;;;;;;;;;;;;;;;
95;Substantive;hair n;das Haar;Susanna's got long black hair.;Susanna hat langes, schwarzes Haar.;She has dark hair.;Sie hat dunkles Haar (=Haare).;;;;;;;;;;;;;;;;;;;;;;
96;Substantive;look n;das Aussehen, der Blick;We want to give the room a new look.;Wir wollen dem Zimmer ein neues Aussehen verleihen.;She gave me an angry look when I kissed Steve.;Sie warf mir einen wütenden Blick zu, als ich Steve küsste.;;;;;;;;;;;;;;;;;;;;;;
97;Verben;look v;aussehen, schauen;My neighbour is over 50, but he looks ten years younger.;Mein Nachbar ist über 50, sieht aber zehn Jahre jünger aus.;We didn't want to buy anything. We were just looking.;Wir wollten nichts kaufen. Wir schauten nur.;He looked very thin.;Er sah sehr mager aus.;He looked round and saw ...;Er schaute sich um und sah ...;;;;;;;;;;;;;;;;;;
98;Adjektive und Adverbien;pretty adj;hübsch;Do you really think she's pretty?;Denkst du wirklich, sie ist hübsch?;Dorothy is very pretty.;Dorothy ist sehr hübsch.;;;;;;;;;;;;;;;;;;;;;;
99;Substantive;beauty n;die Schönheit;Everybody admires her beauty.;Jeder bewundert ihre Schönheit.;She was a little beauty.;Sie war eine kleine Schönheit.;;;;;;;;;;;;;;;;;;;;;;
100;Adjektive und Adverbien;beautiful adj;schön;Mr MacDonald has got two beautiful children.;Mr MacDonald hat zwei schöne Kinder.;Nancy is a beautiful girl.;Nancy ist ein schönes Mädchen.;;;;;;;;;;;;;;;;;;;;;;
101;Sonstige;to be beautiful;schön sein;Her new dress is really beautiful.;Ihr neues Kleid ist wirklich schön.;;;;;;;;;;;;;;;;;;;;;;;;
102;Adjektive und Adverbien;attractive adj;attraktiv;Megan's the most attractive girl in our class.;Megan ist das attraktivste Mädchen in unserer Klasse.;She's got everything a woman needs - she's attractive, intelligent and successful.;Sie hat alles, was eine Frau braucht - sie ist attraktiv, intelligent und erfolgreich.;;;;;;;;;;;;;;;;;;;;;;
103;Adjektive und Adverbien;good-looking adj;gut aussehend;The new head teacher is a good-looking and attractive man.;Der neue Rektor ist ein gut aussehender und attraktiver Mann.;An actor needn't be good-looking but should have an expressive face.;Ein Schauspieler braucht nicht gut auszusehen, sollte aber ein ausdrucksvolles Gesicht haben.;;;;;;;;;;;;;;;;;;;;;;
104;Adjektive und Adverbien;bad-looking adj;schlecht aussehend;She's not a bad-looking woman.;Sie ist keine schlecht aussehende Frau.;;;;;;;;;;;;;;;;;;;;;;;;
105;Adjektive und Adverbien;ugly adj;hässlich;Tony's ugly, but he's got a wonderful personality.;Tony ist hässlich, aber er hat eine wundervolle Persönlichkeit.;She wore an ugly dress.;Sie trug ein hässliches Kleid.;He had an ugly wound on his arm.;Er hatte eine hässliche Wunde am Arm.;;;;;;;;;;;;;;;;;;;;
106;Substantive;figure n;die Figur, die Zahl;No sugar for me, I have to watch my figure.;Kein Zucker für mich, ich muss auf meine Figur achten.;I don't know the latest figures.;Ich kenne die neuesten Zahlen nicht.;That girl has got a beautiful figure.;Das Mädchen hat eine hübsche Figur.;Add up the following figures!;Zählt die folgenden Zahlen zusammen!;;;;;;;;;;;;;;;;;;
107;Adjektive und Adverbien;tall adj;groß;Monica is quite tall for her age.;Monica ist ziemlich groß für ihr Alter.;Rose is rather tall for her age.;Rose ist für ihr Alter ziemlich groß.;;;;;;;;;;;;;;;;;;;;;;
108;Adjektive und Adverbien;big adj;groß und schwer;A couple of big guys were standing next to the owner.;Ein paar große und schwere Kerle standen neben dem Besitzer.;He's a big boy now.;Er ist jetzt ein großer Junge.;;;;;;;;;;;;;;;;;;;;;;
109;Adjektive und Adverbien;strong adj;kräftig, stark;I'm moving house, and I need a few strong guys to help me.;Ich ziehe um und brauche ein paar kräftige Kerle, die mir helfen.;I'm not strong enough to lift this suitcase.;Ich bin nicht stark genug, diesen Koffer zu heben.;;;;;;;;;;;;;;;;;;;;;;
110;Adjektive und Adverbien;fat adj;dick;Sam never gets fat no matter how much chocolate he eats.;Sam wird nie dick, ganz gleich, wie viel Schokolade er isst.;I should eat more healthily because I'm slowly getting fat.;Ich sollte mich gesünder ernähren, weil ich langsam dick werde.;She cannot eat fat meat.;Sie kann kein fettes Fleisch essen.;;;;;;;;;;;;;;;;;;;;
111;Adjektive und Adverbien;short adj;klein, kurz;The short, fat man didn't look very friendly.;Der kleine, dicke Mann sah nicht sehr freundlich aus.;Karen would never wear a short skirt.;Karen würde nie einen kurzen Rock tragen.;The man was short and fat.;Der Mann war klein und dick.;;;;;;;;;;;;;;;;;;;;
112;Adjektive und Adverbien;small adj;klein;When I was a teenager I was rather small for my age.;Als Teenager war ich eher klein für mein Alter.;A small boy was standing at the gate.;Ein kleiner Junge stand am Tor.;;;;;;;;;;;;;;;;;;;;;;
