1958;Substantive;escalator n;die Rolltreppe;The escalator was out of order, so Jake took the stairs.;Die Rolltreppe war außer Betrieb, weshalb Jake die Treppe nahm.;;;;;;;;;;;;;;;;;;;;;;;;
1959;Substantive;shop n;das Geschäft, der Laden;Shops open at 9 o'clock.;Die Geschäfte machen um 9 Uhr auf.;;;;;;;;;;;;;;;;;;;;;;;;
1960;Substantive;store n;das Geschäft, das Warenhaus;;;;;;;;;;;;;;;;;;;;;;;;;;
1961;Substantive;department store n;das Kaufhaus;She saw the towels in a department store.;Sie sah die Handtücher in einem Kaufhaus.;;;;;;;;;;;;;;;;;;;;;;;;
1962;Substantive;supermarket n;der Supermarkt;I bought the wineglasses at the supermarket.;Ich kaufte die Weingläser im Supermarkt.;;;;;;;;;;;;;;;;;;;;;;;;
1963;Substantive;grocer's n BE;das Lebensmittelgeschäft BE;;;;;;;;;;;;;;;;;;;;;;;;;;
1964;Substantive;grocery store n AE;das Lebensmittelgeschäft AE;;;;;;;;;;;;;;;;;;;;;;;;;;
1965;Substantive;market n;der Markt;;;;;;;;;;;;;;;;;;;;;;;;;;
1966;Substantive;bakery n;die Bäckerei;;;;;;;;;;;;;;;;;;;;;;;;;;
1967;Substantive;butcher's (shop) n;die Metzgerei;;;;;;;;;;;;;;;;;;;;;;;;;;
1968;Substantive;greengrocer's n;der Obst- und Gemüseladen;;;;;;;;;;;;;;;;;;;;;;;;;;
1969;Substantive;tobacconist's n BE;der Tabakladen BE;;;;;;;;;;;;;;;;;;;;;;;;;;
1970;Substantive;tobacco store n AE;der Tabakladen AE;;;;;;;;;;;;;;;;;;;;;;;;;;
1971;Substantive;shoe shop n BE;das Schuhgeschäft BE;;;;;;;;;;;;;;;;;;;;;;;;;;
1972;Substantive;shoe store n AE;das Schuhgeschäft AE;;;;;;;;;;;;;;;;;;;;;;;;;;
1973;Substantive;bookshop n BE;die Buchhandlung BE;;;;;;;;;;;;;;;;;;;;;;;;;;
1974;Substantive;bookstore n AE;die Buchhandlung AE;;;;;;;;;;;;;;;;;;;;;;;;;;
1975;Substantive;clothes shop n BE;das Bekleidungsgeschäft BE;;;;;;;;;;;;;;;;;;;;;;;;;;
1976;Substantive;clothes store n AE;das Bekleidungsgeschäft AE;;;;;;;;;;;;;;;;;;;;;;;;;;
1977;Substantive;boutique n;die Boutique;;;;;;;;;;;;;;;;;;;;;;;;;;
1978;Substantive;chemist's n BE;die Drogerie BE;;;;;;;;;;;;;;;;;;;;;;;;;;
1979;Substantive;drugstore n AE;die Drogerie AE;;;;;;;;;;;;;;;;;;;;;;;;;;
1980;Substantive;shopping centre n BE;das Einkaufszentrum BE;;;;;;;;;;;;;;;;;;;;;;;;;;
1981;Substantive;(shopping) mall n AE;das Einkaufszentrum AE;;;;;;;;;;;;;;;;;;;;;;;;;;
1982;Substantive;fishmonger's n;das Fischgeschäft;;;;;;;;;;;;;;;;;;;;;;;;;;
1983;Substantive;florist's n;der Blumenladen;;;;;;;;;;;;;;;;;;;;;;;;;;
1984;Substantive;jeweller n BE;der Juwelier BE;;;;;;;;;;;;;;;;;;;;;;;;;;
1985;Substantive;jeweler n AE;der Juwelier AE;;;;;;;;;;;;;;;;;;;;;;;;;;
1986;Substantive;sports shop n BE;das Sportgeschäft BE;;;;;;;;;;;;;;;;;;;;;;;;;;
1987;Substantive;sports store n AE;das Sportgeschäft AE;;;;;;;;;;;;;;;;;;;;;;;;;;
1988;Substantive;dry cleaner's n;die Reinigung;;;;;;;;;;;;;;;;;;;;;;;;;;
1989;Substantive;electrical shop n BE;die Elektrohandlung BE;;;;;;;;;;;;;;;;;;;;;;;;;;
1990;Substantive;electrical store n AE;die Elektrohandlung AE;;;;;;;;;;;;;;;;;;;;;;;;;;
1991;Substantive;souvenir shop n BE;der Andenkenladen BE;;;;;;;;;;;;;;;;;;;;;;;;;;
1992;Substantive;souvenir store n AE;der Andenkenladen AE;;;;;;;;;;;;;;;;;;;;;;;;;;
1993;Substantive;kiosk n;der Kiosk;;;;;;;;;;;;;;;;;;;;;;;;;;
1994;Substantive;photographic shop n BE;das Fotogeschäft BE;;;;;;;;;;;;;;;;;;;;;;;;;;
1995;Substantive;photographic store n AE;das Fotogeschäft AE;;;;;;;;;;;;;;;;;;;;;;;;;;
1996;Substantive;optician's n;der Optiker;;;;;;;;;;;;;;;;;;;;;;;;;;
1997;Substantive;stationer's n BE;das Schreibwarengeschäft BE;;;;;;;;;;;;;;;;;;;;;;;;;;
1998;Substantive;stationery store n AE;das Schreibwarengeschäft AE;;;;;;;;;;;;;;;;;;;;;;;;;;
1999;Substantive;food n;das Nahrungsmittel, das Lebensmittel, die Nahrung;We must produce more food.;Wir müssen mehr Lebensmittel produzieren.;We should eat more natural food.;Wir sollten natürlichere Nahrung zu uns nehmen.;They serve good food here.;Das Essen hier ist gut.;;;;;;;;;;;;;;;;;;;;
2000;Verben;eat v;essen;You'll get fat if you eat so much.;Du wirst dick, wenn du so viel isst.;Don't eat so much!;Iss nicht so viel!;;;;;;;;;;;;;;;;;;;;;;
2001;Substantive;hunger n;der Hunger;One day there won't be any more hunger in the world.;Eines Tages wird es keinen Hunger mehr auf der Welt geben.;They nearly died of hunger.;Sie starben fast vor Hunger.;;;;;;;;;;;;;;;;;;;;;;
2002;Adjektive und Adverbien;hungry adj;hungrig;I'm so hungry. What's for lunch?;Ich bin so hungrig. Was gibt's zu Mittag?;We were very hungry.;Wir hatten großen Hunger (= waren sehr hungrig).;;;;;;;;;;;;;;;;;;;;;;
2003;Verben;drink v;trinken;Americans drink a lot of water with their meals.;Amerikaner trinken viel Wasser zum Essen.;He drinks too much.;Er trinkt zu viel.;;;;;;;;;;;;;;;;;;;;;;
2004;Substantive;thirst n;der Durst;I had quite a thirst after jogging.;Ich hatte ganz schönen Durst nach dem Joggen.;Thirst is worse than hunger.;Durst ist schlimmer als Hunger.;;;;;;;;;;;;;;;;;;;;;;
2005;Adjektive und Adverbien;thirsty adj;durstig;Working in this heat makes me thirsty.;Bei dieser Hitze zu arbeiten, macht mich durstig.;The children were thirsty.;Die Kinder hatten Durst (= waren durstig).;;;;;;;;;;;;;;;;;;;;;;
2006;Substantive;appetite n;der Appetit;Eating before meals will spoil your appetite.;Wenn man vor den Mahlzeiten isst, verdirbt man sich den Appetit.;I have no appetite today.;Ich habe heute keinen Appetit.;;;;;;;;;;;;;;;;;;;;;;
2007;Substantive;meal n;die Mahlzeit;You should eat five small meals a day instead of three big ones.;Man soll fünf kleine Mahlzeiten am Tag statt drei große essen.;That was a delicious meal!;Das war ein köstliches Essen!;;;;;;;;;;;;;;;;;;;;;;
2008;Sonstige;Enjoy your meal! interj;Guten Appetit!;;;;;;;;;;;;;;;;;;;;;;;;;;
2009;Sonstige;Cheers! interj;Prost!;;;;;;;;;;;;;;;;;;;;;;;;;;
2010;Verben;taste v;schmecken;This stew looks terrible but it tastes great.;Dieser Eintopf sieht fürchterlich aus, aber er schmeckt toll.;These apples taste bad.;Diese Äpfel schmecken schlecht.;;;;;;;;;;;;;;;;;;;;;;
2011;Adjektive und Adverbien;delicious adj;köstlich;The main course was delicious but the dessert was even better.;Die Hauptmahlzeit war köstlich, aber das Dessert war noch besser.;;;;;;;;;;;;;;;;;;;;;;;;
2012;Adjektive und Adverbien;fresh adj;frisch;Could you get some fresh vegetables from the market.;Könntest du frisches Gemüse vom Markt mitbringen.;Fresh fruit keeps you in good health.;Frisches Obst hält dich gesund.;;;;;;;;;;;;;;;;;;;;;;
2013;Adjektive und Adverbien;sweet adj;süß;This wine is too sweet. Don't you have a dry one?;Dieser Wein ist zu süß. Haben Sie keinen trockenen?;The cherries are sweet.;Die Kirschen sind süß.;;;;;;;;;;;;;;;;;;;;;;
2014;Adjektive und Adverbien;sour adj;sauer;Keep the milk in the fridge or it'll go sour.;Bewahre die Milch im Kühlschrank auf, sonst wird sie sauer.;These apples are rather sour.;Diese Äpfel sind ziemlich sauer.;;;;;;;;;;;;;;;;;;;;;;
2015;Adjektive und Adverbien;salty adj;salzig;This soup is much too salty.;Diese Suppe ist viel zu salzig.;;;;;;;;;;;;;;;;;;;;;;;;
2016;Adjektive und Adverbien;hot adj;scharf, heiß;My colleague from Thailand loves his food extremely hot.;Mein Kollege aus Thailand isst sein Essen gern extrem scharf.;In the summer it gets very hot in California.;Im Sommer wird es in Kalifornien sehr heiß.;It's very hot today.;Heute ist es sehr heiß.;;;;;;;;;;;;;;;;;;;;
2017;Adjektive und Adverbien;spicy adj;scharf;I like spicy food, but in India it was too hot for me.;Ich mag scharfes Essen, doch in Indien war es zu scharf für mich.;;;;;;;;;;;;;;;;;;;;;;;;
2018;Substantive;bottle n;die Flasche;We ordered a bottle of wine with our meal.;Wir bestellten eine Flasche Wein zum Essen.;We drank a bottle of wine together.;Wir tranken zusammen eine Flasche Wein.;;;;;;;;;;;;;;;;;;;;;;
2019;Adjektive und Adverbien;cooked adj;gar, gekocht;The filet isn't cooked yet. It's still red.;Das Filet ist noch nicht gar. Es ist noch rot.;When I was a kid I would only eat cooked vegetables.;Als Kind aß ich nur gekochtes Gemüse.;;;;;;;;;;;;;;;;;;;;;;
2020;Verben;cook v;kochen;I'm going to cook tonight and you can do the dishes.;Ich werde heute Abend kochen und du kannst den Abwasch machen.;;;;;;;;;;;;;;;;;;;;;;;;
2021;Verben;boil v;kochen;The water is boiling. Could you turn off the cooker?;Das Wasser kocht. Könntest du den Herd ausmachen?;The water is boiling.;Das Wasser kocht.;;;;;;;;;;;;;;;;;;;;;;
2022;Adjektive und Adverbien;hard-boiled adj;hart gekocht;Would you like your egg hard-boiled or soft-boiled?;Möchten Sie Ihr Ei hart gekocht oder weich gekocht?;;;;;;;;;;;;;;;;;;;;;;;;
2023;Adjektive und Adverbien;raw adj;roh;Joe is on a diet. He's only eating raw vegetables at the moment.;Joe macht eine Diät. Er isst im Moment nur rohes Gemüse.;Dogs like to eat raw meat.;Hunde fressen gern(e) rohes Fleisch.;;;;;;;;;;;;;;;;;;;;;;
2024;Verben;bake v;backen;My mother used to bake our bread herself.;Meine Mutter hat unser Brot immer selbst gebacken.;Mother baked a cake for the children.;Mutter backte einen Kuchen für die Kinder.;;;;;;;;;;;;;;;;;;;;;;
2025;Verben;roast v;backen;Roast the meat in the oven at 200 degrees centigrade.;Backe das Fleisch im Ofen bei 200 Grad Celsius.;They roasted some meat.;Sie brieten (ein Stück) Fleisch.;;;;;;;;;;;;;;;;;;;;;;
2026;Sonstige;to warm up;warm machen;We'll have to warm up the leftovers.;Wir müssen die Reste warm machen.;;;;;;;;;;;;;;;;;;;;;;;;
2027;Verben;cut v;schneiden;We ordered a large pizza and cut it into four pieces.;Wir bestellten eine große Pizza und schnitten sie in vier Teile.;She cut a slice of bread.;Sie schnitt eine Scheibe Brot ab.;I've cut my finger.;Ich habe mich in den Finger geschnitten.;;;;;;;;;;;;;;;;;;;;
2028;Adjektive und Adverbien;frozen adj;tiefgekühlt, Tiefkühl-;Is frozen fish as healthy as fresh fish?;Ist tiefgekühlter Fisch genauso gesund wie frischer?;Why do you think people are eating more and more frozen food?;Warum, glaubst du, essen die Menschen immer mehr Tiefkühlkost?;;;;;;;;;;;;;;;;;;;;;;
2029;Substantive;slice n;die Scheibe;Marie spread butter and jam on a slice of toast.;Marie bestrich eine Scheibe Toast mit Butter und Konfitüre.;He cut himself a slice of bread.;Er schnitt sich eine Scheibe Brot ab.;;;;;;;;;;;;;;;;;;;;;;
2030;Substantive;drop n;der Tropfen;Put a few drops of oil into the water for the spaghetti.;Gib ein paar Tropfen Öl ins Spaghettiwasser.;There wasn't a drop of beer in the house.;Kein Tropfen Bier war im Haus.;;;;;;;;;;;;;;;;;;;;;;
2031;Substantive;diet n;die Ernährung, die Diät;The main reason for obesity is bad diet.;Der Hauptgrund für Fettleibigkeit ist schlechte Ernährung.;Laura looks healthier since she's been on that vegetarian diet.;Laura sieht gesünder aus, seit sie diese vegetarische Diät macht.;;;;;;;;;;;;;;;;;;;;;;
2032;Verben;consume v;verzehren, zu sich nehmen;I should reduce the amount of chocolate I consume.;Ich sollte die Menge an Schokolade reduzieren, die ich verzehre.;;;;;;;;;;;;;;;;;;;;;;;;
2033;Verben;swallow v;(herunter)schlucken;Chew your food well before you swallow it.;Kau das Essen tüchtig, bevor du es herunterschluckst!;You must swallow the pill.;Du musst die Pille schlucken.;;;;;;;;;;;;;;;;;;;;;;
2034;Substantive;taste n;der Geschmack;This soup needs more salt. It has hardly any taste.;Diese Suppe braucht mehr Salz. Sie hat kaum Geschmack.;I don't like the taste of this cheese.;Ich mag den Geschmack von diesem Käse nicht.;;;;;;;;;;;;;;;;;;;;;;
2035;Verben;fry v;braten;You need to fry this steak for one minute on both sides.;Du musst dieses Steak eine Minute lang von beiden Seiten braten.;They fried the fish.;Sie brieten den Fisch.;;;;;;;;;;;;;;;;;;;;;;
2036;Verben;grill v BE;grillen BE;In the summertime we like to grill in the garden.;Im Sommer grillen wir gern im Garten.;;;;;;;;;;;;;;;;;;;;;;;;
2037;Verben;broil v AE;grillen AE;Broiled meat is not as healthy as cooked meat.;Gegrilltes Fleisch ist nicht so gesund wie gekochtes.;;;;;;;;;;;;;;;;;;;;;;;;
2038;Verben;deep-fry v;frittieren;When eating steak, we like to deep-fry the potatoes ourselves.;Wenn wir Steak essen, frittieren wir die Kartoffeln gern selbst.;;;;;;;;;;;;;;;;;;;;;;;;
2039;Substantive;packet n BE;die Packung BE;Tony bought a packet of dried peas.;Tony hat eine Packung Trockenerbsen gekauft.;;;;;;;;;;;;;;;;;;;;;;;;
2040;Substantive;package n AE;die Packung AE;;;;;;;;;;;;;;;;;;;;;;;;;;
2041;Substantive;can n;die Dose;Instead of opening a can you should eat fresh vegetables.;Statt eine Dose zu öffnen, sollte man frisches Gemüse essen.;She opened a can of peaches.;Sie öffnete eine Dose Pfirsiche.;;;;;;;;;;;;;;;;;;;;;;
2042;Substantive;tin n BE;die Dose BE;Don't buy a tin if it's damaged.;Kaufe keine beschädigten Dosen.;She opened a tin of vegetables.;Sie öffnete eine Dose Gemüse.;;;;;;;;;;;;;;;;;;;;;;
2043;Verben;store v;lagern;Store the potatoes in a dark and cool place.;Lagere die Kartoffeln an einem dunklen, kühlen Ort.;;;;;;;;;;;;;;;;;;;;;;;;
2044;Sonstige;to go bad;verderben;Keep the vegetables in the refrigerator so they don't go bad.;Lagere das Gemüse im Kühlschrank, damit es nicht verdirbt.;;;;;;;;;;;;;;;;;;;;;;;;
2045;Sonstige;to go off;verderben;This meat smells funny. I think it's gone off.;Dieses Fleisch riecht komisch. Ich glaube, es ist verdorben.;;;;;;;;;;;;;;;;;;;;;;;;
2046;Adjektive und Adverbien;ripe adj;reif;This pineapple is ripe and juicy.;Diese Ananas ist reif und saftig.;These apples are not ripe.;Diese Äpfel sind nicht reif.;;;;;;;;;;;;;;;;;;;;;;
2047;Adjektive und Adverbien;bitter adj;bitter;Coffee without sugar tastes bitter.;Kaffee ohne Zucker schmeckt bitter.;Black coffee has a bitter taste.;Schwarzer Kaffee hat einen bitteren Geschmack.;;;;;;;;;;;;;;;;;;;;;;
2048;Adjektive und Adverbien;dry adj;trocken;Nick often gets a headache when he drinks dry wine.;Nick bekommt häufig Kopfschmerzen, wenn er trockenen Wein trinkt.;The weather in Arizona is almost always sunny and dry.;Das Wetter in Arizona ist fast immer sonnig und trocken.;Put on some dry clothes.;Zieh trockene Kleider an!;;;;;;;;;;;;;;;;;;;;
2049;Adjektive und Adverbien;freshly-squeezed adj;frisch gepresst;Could I have some freshly-squeezed orange juice, please?;Könnte ich bitte einen frisch gepressten Orangensaft haben?;;;;;;;;;;;;;;;;;;;;;;;;
2050;Adjektive und Adverbien;grated adj;gerieben;There's more grated cheese in the fridge.;Es gibt noch geriebenen Käse im Kühlschrank.;;;;;;;;;;;;;;;;;;;;;;;;
2051;Substantive;health food n;die Reformkost;Sam is trying to eat only health food.;Sam versucht, nur Reformkost zu essen.;;;;;;;;;;;;;;;;;;;;;;;;
2052;Substantive;vegetarian n;der Vegetarier, die Vegetarierin;Kevin's not a vegetarian, he's a vegan.;Kevin ist kein Vegetarier, er ist Veganer.;;;;;;;;;;;;;;;;;;;;;;;;
2053;Adjektive und Adverbien;vegetarian adj;vegetarisch;I got a vegetarian cookbook for my birthday.;Ich habe ein vegetarisches Kochbuch zum Geburtstag bekommen.;;;;;;;;;;;;;;;;;;;;;;;;
2054;Adjektive und Adverbien;wholegrain adj;Vollkorn-;The supermarket has got a new selection of wholegrain products.;Der Supermarkt hat eine neue Auswahl an Vollkornprodukten.;;;;;;;;;;;;;;;;;;;;;;;;
2055;Substantive;wholefoods n;die Vollwertkost;Gordon doesn't drink alcohol and only eats wholefoods.;Gordon trinkt keinen Alkohol und isst nur Vollwertkost.;;;;;;;;;;;;;;;;;;;;;;;;
2056;Substantive;fat n;das Fett;Pork contains a lot of fat.;Schweinefleisch enthält viel Fett.;There is a lot of fat on this pork.;An diesem Schweinefleisch ist viel Fett.;;;;;;;;;;;;;;;;;;;;;;
2057;Adjektive und Adverbien;low-fat adj;fettarm;George bought a low-fat yoghurt and a full-fat one.;George hat einen fettarmen und einen Vollmilchjoghurt gekauft.;;;;;;;;;;;;;;;;;;;;;;;;
2058;Adjektive und Adverbien;lean adj;mager;Lean meat is said to be healthier than fatty meat.;Mageres Fleisch soll gesünder sein als fettes.;Lean meat contains little or no fat.;Mageres Fleisch enthält wenig oder gar kein Fett.;;;;;;;;;;;;;;;;;;;;;;
2059;Substantive;vitamin n;das Vitamin;Which fruit contains the most vitamins?;Welches Obst enthält die meisten Vitamine?;;;;;;;;;;;;;;;;;;;;;;;;
2060;Substantive;recipe n;das Rezept;Could you give me the recipe for this cheesecake?;Kannst du mir das Rezept für diesen Käsekuchen geben?;;;;;;;;;;;;;;;;;;;;;;;;
2061;Verben;season v;würzen;Season your gumbo with lots of chili.;Würzen Sie Ihr Gumbo mit viel Chili.;;;;;;;;;;;;;;;;;;;;;;;;
2062;Verben;add v;hinzufügen, addieren;You only need to add 50 grams of flour.;Man muss nur 50 Gramm Mehl hinzufügen.;If you add 12 and 15 you get 27.;Wenn man 12 und 15 addiert, bekommt man 27.;You must add some more salt to the soup.;Du musst noch etwas Salz in die Suppe geben (= der Suppe ... hinzufügen).;Add 10 and 6.;Zählt 10 und 6 zusammen!;;;;;;;;;;;;;;;;;;
2063;Verben;spill v;verschütten;I spilled hot coffee all over the table.;Ich habe heißen Kaffee über den ganzen Tisch verschüttet.;;;;;;;;;;;;;;;;;;;;;;;;
2064;Substantive;peeling n;die Schale;I like eating potatoes with their peelings.;Ich esse gern Kartoffeln mit Schale.;;;;;;;;;;;;;;;;;;;;;;;;
2065;Verben;peel v;schälen;You don't have to peel an apple before you eat it.;Man braucht einen Apfel nicht zu schälen, bevor man ihn isst.;;;;;;;;;;;;;;;;;;;;;;;;
2066;Sonstige;to have a picnic;picknicken, ein Picknick veranstalten;Let's have a picnic in the park next Sunday.;Lasst uns nächsten Sonntag ein Picknick im Park veranstalten.;;;;;;;;;;;;;;;;;;;;;;;;
2067;Substantive;bread n;das Brot;We must buy some bread.;Wir müssen Brot kaufen.;;;;;;;;;;;;;;;;;;;;;;;;
2068;Substantive;roll n;das Brötchen;We had some cheese rolls.;Wir aßen Käsebrötchen.;;;;;;;;;;;;;;;;;;;;;;;;
2069;Substantive;bun n;das süße Brötchen;;;;;;;;;;;;;;;;;;;;;;;;;;
2070;Substantive;toast n;der Toast;;;;;;;;;;;;;;;;;;;;;;;;;;
2071;Substantive;noodles n pl;die Nudeln;;;;;;;;;;;;;;;;;;;;;;;;;;
2072;Substantive;pasta n;die Nudeln;;;;;;;;;;;;;;;;;;;;;;;;;;
2073;Substantive;rice n;der Reis;They eat a lot of rice in Asia.;Man isst viel Reis in Asien.;;;;;;;;;;;;;;;;;;;;;;;;
2074;Substantive;cake n;der Kuchen;She made us a cake.;Sie backte einen Kuchen für uns.;;;;;;;;;;;;;;;;;;;;;;;;
2075;Substantive;gateau n;die Torte;;;;;;;;;;;;;;;;;;;;;;;;;;
2076;Substantive;biscuit n BE;der Keks BE;;;;;;;;;;;;;;;;;;;;;;;;;;
2077;Substantive;cookie n AE;der Keks AE;;;;;;;;;;;;;;;;;;;;;;;;;;
2078;Substantive;muffin n;der Muffin;;;;;;;;;;;;;;;;;;;;;;;;;;
2079;Substantive;flour n;das Mehl;Add 300 g of flour.;Geben Sie 300 g Mehl dazu!;;;;;;;;;;;;;;;;;;;;;;;;
2080;Substantive;white bread n;das Weißbrot;;;;;;;;;;;;;;;;;;;;;;;;;;
2081;Substantive;brown bread n;das Graubrot;;;;;;;;;;;;;;;;;;;;;;;;;;
2082;Substantive;cereals n pl;die Zerealien;Cereals such as cornflakes are often eaten for breakfast.;Getreideflocken, wie z.B. Cornflakes, werden viel zum Frühstück gegessen.;;;;;;;;;;;;;;;;;;;;;;;;
2083;Substantive;muesli n;das Müsli;;;;;;;;;;;;;;;;;;;;;;;;;;
2084;Substantive;scone n BE;kleines süßes Brötchen mit Rosinen BE AE;;;;;;;;;;;;;;;;;;;;;;;;;;
2085;Substantive;doughnut n;der Krapfen, der Donut;;;;;;;;;;;;;;;;;;;;;;;;;;
2086;Substantive;salad n;der Salat;Do you like my salad?;Schmeckt Ihnen mein Salat?;;;;;;;;;;;;;;;;;;;;;;;;
2087;Substantive;potato n;die Kartoffel;I took some more potatoes.;Ich nahm mir noch ein paar Kartoffeln.;;;;;;;;;;;;;;;;;;;;;;;;
2088;Substantive;sweetcorn n;der Mais;;;;;;;;;;;;;;;;;;;;;;;;;;
2089;Substantive;vegetable n;das Gemüse, Pflanzen-;Beans contain a lot of vegetable protein.;Bohnen enthalten viel Pflanzeneiweiß.;;;;;;;;;;;;;;;;;;;;;;;;
2090;Substantive;tomato n;die Tomate;I like spaghetti with tomato sauce.;Ich esse gern Spaghetti mit Tomatensoße.;;;;;;;;;;;;;;;;;;;;;;;;
2091;Substantive;carrot n;die Mohrrübe;Rabbits love carrots.;Kaninchen fressen sehr gern Möhren.;;;;;;;;;;;;;;;;;;;;;;;;
2092;Substantive;olive n;die Olive;;;;;;;;;;;;;;;;;;;;;;;;;;
2093;Substantive;pea n;die Erbse;For vegetables we'll have carrots and green peas from our garden.;Als Gemüse gibt es Möhren und grüne Erbsen aus unserem Garten.;;;;;;;;;;;;;;;;;;;;;;;;
2094;Substantive;cucumber n;die Gurke;;;;;;;;;;;;;;;;;;;;;;;;;;
2095;Substantive;pepper n;die Paprika, der Pfeffer;This salad has too much pepper.;An diesem Salat ist zu viel Pfeffer.;;;;;;;;;;;;;;;;;;;;;;;;
2096;Substantive;sauerkraut n;das Sauerkraut;;;;;;;;;;;;;;;;;;;;;;;;;;
2097;Substantive;peach n;der Pfirsich;;;;;;;;;;;;;;;;;;;;;;;;;;
2098;Substantive;fruit n;das Obst, die Frucht;The fruits of this tree are very sweet.;Die Früchte von diesem Baum sind sehr süß.;Do you like fruit?;Mögen Sie Obst?;;;;;;;;;;;;;;;;;;;;;;
2099;Substantive;apple n;der Apfel;;;;;;;;;;;;;;;;;;;;;;;;;;
2100;Substantive;pear n;die Birne;These are apples and pears from our own garden.;Dies sind Äpfel und Birnen aus unserem eigenen Garten.;;;;;;;;;;;;;;;;;;;;;;;;
2101;Substantive;orange n;die Orange;Marmalade is made of oranges and other citrus fruits.;Marmelade wird aus Orangen und anderen Zitrusfrüchten hergestellt.;;;;;;;;;;;;;;;;;;;;;;;;
2102;Substantive;cherry n;die Kirsche;Kirsch is a strong alcoholic drink made from cherries.;Kirschwasser ist ein starker Schnaps, der aus Kirschen gemacht wird.;;;;;;;;;;;;;;;;;;;;;;;;
2103;Substantive;strawberry n;die Erdbeere;At Wimbledon spectators eat strawberries with cream.;In Wimbledon essen die Zuschauer Erdbeeren mit Sahne.;;;;;;;;;;;;;;;;;;;;;;;;
2104;Substantive;banana n;die Banane;Monkeys like bananas.;Affen essen gern Bananen.;;;;;;;;;;;;;;;;;;;;;;;;
2105;Substantive;lemon n;die Zitrone;Fried fish is served with slices of lemon.;Gebratener Fisch wird mit Zitronenscheiben serviert.;;;;;;;;;;;;;;;;;;;;;;;;
2106;Substantive;lime n;die Limone;;;;;;;;;;;;;;;;;;;;;;;;;;
2107;Substantive;pineapple n;die Ananas;;;;;;;;;;;;;;;;;;;;;;;;;;
2108;Substantive;onion n;die Zwiebel;Cutting up onions makes my eyes water.;Wenn ich Zwiebeln schneide, tränen mir die Augen.;;;;;;;;;;;;;;;;;;;;;;;;
2109;Substantive;garlic n;der Knoblauch;;;;;;;;;;;;;;;;;;;;;;;;;;
2110;Substantive;haricot bean n;die weiße Bohne;;;;;;;;;;;;;;;;;;;;;;;;;;
2111;Substantive;chickpea n;die Kichererbse;;;;;;;;;;;;;;;;;;;;;;;;;;
2112;Substantive;bean n;die Bohne;Mexican chil(l)i is made from meat, beans and spices.;Mexikanisches Chili macht man aus Fleisch, Bohnen und Gewürzen.;;;;;;;;;;;;;;;;;;;;;;;;
2113;Substantive;spinach n;der Spinat;;;;;;;;;;;;;;;;;;;;;;;;;;
2114;Substantive;legume n;die Hülsenfrucht;;;;;;;;;;;;;;;;;;;;;;;;;;
2115;Substantive;aubergine n BE;die Aubergine BE;;;;;;;;;;;;;;;;;;;;;;;;;;
2116;Substantive;eggplant n AE;die Aubergine AE;;;;;;;;;;;;;;;;;;;;;;;;;;
2117;Substantive;courgette n BE;die Zucchini BE;;;;;;;;;;;;;;;;;;;;;;;;;;
2118;Substantive;zucchini n AE;die Zucchini AE;;;;;;;;;;;;;;;;;;;;;;;;;;
2119;Substantive;cabbage n;der Kohl;Sauerkraut is made from cabbage.;Sauerkraut wird aus Kohl gemacht.;;;;;;;;;;;;;;;;;;;;;;;;
2120;Substantive;apricot n;die Aprikose;;;;;;;;;;;;;;;;;;;;;;;;;;
2121;Substantive;grape n;die Traube;;;;;;;;;;;;;;;;;;;;;;;;;;
2122;Substantive;nut n;die Nuss;I like my muesli with lots of nuts and raisins.;Ich esse mein Müsli gern mit vielen Nüssen und Rosinen.;;;;;;;;;;;;;;;;;;;;;;;;
2123;Substantive;peanut n;die Erdnuss;;;;;;;;;;;;;;;;;;;;;;;;;;
2124;Substantive;walnut n;die Walnuss;;;;;;;;;;;;;;;;;;;;;;;;;;
2125;Substantive;almond n;die Mandel;;;;;;;;;;;;;;;;;;;;;;;;;;
2126;Substantive;melon n;die Melone;;;;;;;;;;;;;;;;;;;;;;;;;;
2127;Substantive;honeydew melon n;die Honigmelone;;;;;;;;;;;;;;;;;;;;;;;;;;
2128;Substantive;watermelon n;die Wassermelone;;;;;;;;;;;;;;;;;;;;;;;;;;
2129;Substantive;grapefruit n;die Grapefruit, die Pampelmuse;;;;;;;;;;;;;;;;;;;;;;;;;;
2130;Substantive;meat n;das Fleisch;I'm not a vegetarian, but I don't like meat.;Ich bin kein Vegetarier, aber ich esse nicht gern Fleisch.;;;;;;;;;;;;;;;;;;;;;;;;
2131;Substantive;pork n;das Schweinefleisch;Jews and Muslims don't eat pork.;Juden und Moslems essen kein Schweinefleisch.;;;;;;;;;;;;;;;;;;;;;;;;
2132;Substantive;beef n;das Rindfleisch;A lot of beef is needed for the big hamburger chains.;Für die großen Hamburger-Ketten wird viel Rindfleisch gebraucht.;;;;;;;;;;;;;;;;;;;;;;;;
2133;Substantive;veal n;das Kalbfleisch;A Wiener schnitzel is a breaded and fried veal cutlet.;Ein Wiener Schnitzel ist ein paniertes und gebratenes Kalbsschnitzel.;;;;;;;;;;;;;;;;;;;;;;;;
2134;Substantive;chicken n;das Hühnchen, das Huhn;We only eat eggs from our own chickens.;Wir essen nur Eier von unseren eigenen Hühnern.;My mother fed me chicken soup when I was ill.;Meine Mutter gab mir Hühnersuppe zu essen, wenn ich krank war.;;;;;;;;;;;;;;;;;;;;;;
2135;Substantive;steak n;das Steak;Would you like your steak rare, medium or well-done?;"Möchten Sie Ihr Steak ""englisch"", ""medium"" oder gut durchgebraten?";;;;;;;;;;;;;;;;;;;;;;;;
2136;Substantive;wing n;der Flügel;The bird had an injured wing.;Der Vogel hatte einen verletzten Flügel.;;;;;;;;;;;;;;;;;;;;;;;;
2137;Substantive;sausage n;das Würstchen;Frankfurters are small reddish smoked sausages.;Frankfurter sind kleine rötliche, geräucherte Würstchen.;;;;;;;;;;;;;;;;;;;;;;;;
2138;Substantive;ham n;der Schinken;Americans often have ham and eggs for breakfast.;Amerikaner essen oft Eier und Schinken zum Frühstück.;;;;;;;;;;;;;;;;;;;;;;;;
2139;Substantive;salami n;die Salami;;;;;;;;;;;;;;;;;;;;;;;;;;
2140;Substantive;bacon n;der Speck;Bacon and eggs is always included in a full English breakfast.;Eier und Speck gehören stets zu einem kompletten englischen Frühstück.;;;;;;;;;;;;;;;;;;;;;;;;
2141;Substantive;fish n;der Fisch;We went fishing and caught a lot of fish.;Wir waren angeln und haben eine Menge Fische gefangen.;;;;;;;;;;;;;;;;;;;;;;;;
