947;Verben;cure v;heilen;Nothing seems to cure me of my stage fright.;Nichts scheint mein Lampenfieber heilen zu können.;The doctor cured her of her backache.;Der Arzt heilte sie von ihren Rückenschmerzen.;;;;;;;;;;;;;;;;;;;;;;
948;Verben;bear v;ertragen;I can't bear the thought of having to write it.;Ich kann den Gedanken nicht ertragen, das schreiben zu müssen.;This tree is bearing for the first time this year.;Dieser Baum trägt dieses Jahr zum ersten Mal.;;;;;;;;;;;;;;;;;;;;;;
949;Adjektive und Adverbien;unbearable adj;unerträglich;The pain in my leg was unbearable.;Der Schmerz in meinem Bein war unerträglich.;;;;;;;;;;;;;;;;;;;;;;;;
950;Adjektive und Adverbien;blind adj;blind;There is a blind old man sitting in the park playing his guitar.;Da sitzt ein blinder alter Mann im Park und spielt Gitarre.;The old man is blind in one eye.;Der alte Mann ist auf einem Auge blind.;;;;;;;;;;;;;;;;;;;;;;
951;Adjektive und Adverbien;deaf adj;taub;Grandpa only pretends to be deaf.;Opa tut nur so, als sei er taub.;The old woman was deaf.;Die alte Frau war taub.;You'll become deaf with all that noise.;Sie werden von all dem Lärm schwerhörig werden.;;;;;;;;;;;;;;;;;;;;
952;Sonstige;hard of hearing;schwerhörig;You'll have to shout. My father is hard of hearing.;Du wirst schreien müssen. Mein Vater ist schwerhörig.;;;;;;;;;;;;;;;;;;;;;;;;
953;Verben;tremble v;zittern;Nicola trembled with excitement.;Nicola zitterte vor Aufregung.;Her hands were trembling.;Ihre Hände zitterten.;;;;;;;;;;;;;;;;;;;;;;
954;Verben;shake v;zittern;Andrea shook with rage.;Andrea zitterte vor Wut.;Shake well before use.;Vor Gebrauch gut schütteln!;;;;;;;;;;;;;;;;;;;;;;
955;Verben;swell v;(an)schwellen;My feet always swell when I have to stand for a long time.;Meine Füße schwellen immer an, wenn ich lange stehen muss.;Her hand began to swell.;Ihre Hand begann anzuschwellen.;;;;;;;;;;;;;;;;;;;;;;
956;Substantive;infection n;die Infektion;The virus weakens the body's defences against infection.;Das Virus schwächt die Abwehrkraft des Körpers gegen Infektionen.;The AIDS virus weakens the body's natural defences against infections.;Das AIDS-Virus schwächt die natürlichen Abwehrkräfte des Körpers gegen Infektionen.;;;;;;;;;;;;;;;;;;;;;;
957;Adjektive und Adverbien;infectious adj;ansteckend;This disease is not infectious.;Diese Krankheit ist nicht ansteckend.;Flu is a highly infectious disease.;Grippe ist eine äußerst ansteckende Krankheit.;;;;;;;;;;;;;;;;;;;;;;
958;Adjektive und Adverbien;contagious adj;ansteckend;This disease is highly contagious.;Diese Krankheit ist hoch ansteckend.;;;;;;;;;;;;;;;;;;;;;;;;
959;Substantive;bacteria n;die Bakterie;The infection was caused by bacteria.;Die Infektion wurde durch Bakterien verursacht.;;;;;;;;;;;;;;;;;;;;;;;;
960;Substantive;virus n;das Virus;Can this virus be transmitted by cats?;Kann dieses Virus von Katzen übertragen werden?;;;;;;;;;;;;;;;;;;;;;;;;
961;Substantive;inflammation n;die Entzündung;The inflammation is going down. My eye is no longer red.;Die Entzündung ist zurückgegangen. Mein Auge ist nicht mehr rot.;;;;;;;;;;;;;;;;;;;;;;;;
962;Sonstige;to be sore;entzündet sein, wund sein, wehtun;The baby's eyes were sore when it woke up.;Die Augen des Babys waren entzündet, als es aufwachte.;My feet were sore from walking too much.;Meine Füße waren vom vielen Gehen ganz wund.;;;;;;;;;;;;;;;;;;;;;;
963;Substantive;flu n;die Grippe;The flu is an infectious disease like a cold.;Grippe ist eine ansteckende Krankheit wie eine Erkältung.;;;;;;;;;;;;;;;;;;;;;;;;
964;Substantive;cancer n;der Krebs;Her mother died of cancer last year.;Ihre Mutter starb letztes Jahr an Krebs.;;;;;;;;;;;;;;;;;;;;;;;;
965;Substantive;heart attack n;der Herzinfarkt;Mr Cairns suffered a massive heart attack.;Mr Cairns erlitt einen schweren Herzinfarkt.;;;;;;;;;;;;;;;;;;;;;;;;
966;Substantive;dizziness n;der Schwindel;This medicine may cause vomiting and dizziness.;Dieses Medikament kann Brechreiz und Schwindel verursachen.;;;;;;;;;;;;;;;;;;;;;;;;
967;Sonstige;to feel dizzy;schwindelig sein;Standing up too quickly makes me feel dizzy.;Wenn ich zu schnell aufstehe, wird mir schwindelig.;;;;;;;;;;;;;;;;;;;;;;;;
968;Substantive;diarrhoea n BE;der Durchfall BE;I asked at the chemist's for a remedy for diarrhoea.;Ich fragte in der Apotheke nach einem Mittel gegen Durchfall.;;;;;;;;;;;;;;;;;;;;;;;;
969;Substantive;diarrhea n AE;der Durchfall AE;;;;;;;;;;;;;;;;;;;;;;;;;;
970;Substantive;seizure n;der Anfall;Al had a seizure after swallowing the pill.;Al hatte einen Anfall, nachdem er die Tablette geschluckt hatte.;;;;;;;;;;;;;;;;;;;;;;;;
971;Substantive;AIDS n;Aids;You should protect yourself against AIDS.;Man sollte sich gegen Aids schützen.;;;;;;;;;;;;;;;;;;;;;;;;
972;Substantive;allergy n;die Allergie;I have an allergy to eggs.;Ich habe eine Allergie gegen Eier.;;;;;;;;;;;;;;;;;;;;;;;;
973;Substantive;diabetes n;der Diabetes;Jill has been suffering from diabetes since she was 20.;Jill leidet unter Diabetes, seit sie 20 ist.;;;;;;;;;;;;;;;;;;;;;;;;
974;Substantive;abortion n;die Abtreibung;It is hard for a woman to have an abortion.;Es ist schwer für eine Frau, eine Abtreibung vornehmen zu lassen.;;;;;;;;;;;;;;;;;;;;;;;;
975;Substantive;caries n;die Karies;The dentist said I had caries.;Der Zahnarzt sagte, ich hätte Karies.;;;;;;;;;;;;;;;;;;;;;;;;
976;Substantive;tooth decay n;die Karies;If you don't brush your teeth regularly you'll get tooth decay.;Wenn du deine Zähne nicht regelmäßig putzt, bekommst du Karies.;;;;;;;;;;;;;;;;;;;;;;;;
977;Substantive;stress n;der Stress;I've been under a lot of stress lately.;Ich stehe in letzter Zeit sehr unter Stress.;;;;;;;;;;;;;;;;;;;;;;;;
978;Sonstige;to get sunburn;einen Sonnenbrand bekommen;Would you get sunburn on Mars?;Würde man auf dem Mars einen Sonnenbrand bekommen?;;;;;;;;;;;;;;;;;;;;;;;;
979;Sonstige;to get used to;sich gewöhnen an;You'll have to get used to these freezing temperatures.;Du wirst dich an diese eisigen Temperaturen gewöhnen müssen.;;;;;;;;;;;;;;;;;;;;;;;;
980;Substantive;alcoholic n;der Alkoholiker, die Alkoholikerin;His father was an alcoholic and died young.;Sein Vater war Alkoholiker und starb jung.;;;;;;;;;;;;;;;;;;;;;;;;
981;Substantive;drug n;die Droge, das Rauschgift;Heroin and cocaine are so-called hard drugs.;Heroin und Kokain sind sogenannte harte Drogen.;There's a new drug for headaches.;Es gibt ein neues Mittel gegen Kopfschmerzen.;;;;;;;;;;;;;;;;;;;;;;
982;Sonstige;to take drugs;Drogen nehmen;Karl used to take drugs, but he's clean now.;Früher nahm Karl Drogen, doch jetzt ist er clean.;;;;;;;;;;;;;;;;;;;;;;;;
983;Substantive;(drug) addict n;der Drogenabhängige, die Drogenabhängige;Ian was a drug addict and has been treated at a clinic.;Ian war ein Drogenabhängiger und wurde in einer Klinik behandelt.;;;;;;;;;;;;;;;;;;;;;;;;
984;Adjektive und Adverbien;addicted to drugs adj;drogensüchtig;Melanie had been addicted to drugs for years.;Melanie war jahrelang drogensüchtig.;;;;;;;;;;;;;;;;;;;;;;;;
985;Substantive;examination n;die Untersuchung, die Prüfung;I had to undergo a medical examination.;Ich musste mich einer medizinischen Untersuchung unterziehen.;You'll have to take an examination to pass the course.;Ihr werdet eine Prüfung ablegen müssen, um den Kurs zu bestehen.;;;;;;;;;;;;;;;;;;;;;;
986;Verben;examine v;untersuchen;Jake was examined by a woman doctor.;Jake wurde von einer Ärztin untersucht.;;;;;;;;;;;;;;;;;;;;;;;;
987;Substantive;treatment n;die Behandlung;I received treatment for my dizzy spells.;Ich erhielt eine Behandlung gegen meine Schwindelanfälle.;Peter got medical treatment.;Peter wurde ärztlich behandelt.;;;;;;;;;;;;;;;;;;;;;;
988;Substantive;medicine n;die Medizin;Mum poured the medicine onto the spoon.;Mama goss die Medizin auf einen Löffel.;Take this medicine for your cough.;Nimm diese Medizin für deinen Husten.;;;;;;;;;;;;;;;;;;;;;;
989;Substantive;medication n;das Medikament;Jason had forgotten to take his medication.;Jason hatte vergessen, sein Medikament zu nehmen.;;;;;;;;;;;;;;;;;;;;;;;;
990;Adjektive und Adverbien;medical adj;medizinisch;Pat can't drink alcohol for medical reasons.;Pat darf aus medizinischen Gründen keinen Alkohol trinken.;She received medical care.;Sie wurde medizinisch versorgt.;Eric's girlfriend is a medical student.;Erics Freundin ist Medizinstudentin.;;;;;;;;;;;;;;;;;;;;
991;Sonstige;to be on medication;Medikamente (ein)nehmen;I'm not going to drink any alcohol, because I'm on medication.;Ich werde keinen Alkohol trinken, da ich Medikamente nehme.;;;;;;;;;;;;;;;;;;;;;;;;
992;Substantive;surgery n;die Praxis;The surgery is closed on Friday afternoons.;Die Praxis ist freitagnachmittags geschlossen.;;;;;;;;;;;;;;;;;;;;;;;;
993;Substantive;doctor's office n AE;die Praxis AE;Today I had to wait for two hours at the doctor's office.;Heute musste ich zwei Stunden in der Praxis warten.;;;;;;;;;;;;;;;;;;;;;;;;
994;Substantive;surgery hours n pl BE;die Sprechstunde BE;Surgery hours are from 8 am to 1 pm.;Die Sprechstunde ist von 8 bis 13 Uhr.;;;;;;;;;;;;;;;;;;;;;;;;
995;Substantive;office hours n pl AE;die Sprechstunde AE;There are no office hours today because the doctor's ill.;Heute gibt es keine Sprechstunde, weil der Arzt krank ist.;;;;;;;;;;;;;;;;;;;;;;;;
996;Substantive;prescription n;das Rezept;The doctor gave Barry a prescription for his cough.;Der Arzt gab Barry ein Rezept gegen seinen Husten.;;;;;;;;;;;;;;;;;;;;;;;;
997;Verben;prescribe v;verschreiben;This drug was prescribed by her doctor.;Dieses Medikament wurde ihr von ihrem Arzt verschrieben.;;;;;;;;;;;;;;;;;;;;;;;;
998;Substantive;pill n;die Tablette, die Pille;I took a pill and didn't get seasick.;Ich habe eine Tablette genommen und wurde nicht seekrank.;I took a pill - so I didn't get seasick.;Ich habe eine Tablette genommen und wurde nicht seekrank.;;;;;;;;;;;;;;;;;;;;;;
999;Substantive;hospital n;das Krankenhaus;Sue works as a nurse in a hospital.;Sue arbeitet als Krankenschwester in einem Krankenhaus.;Is she still in hospital?;Ist sie noch im Krankenhaus?;;;;;;;;;;;;;;;;;;;;;;
1000;Substantive;clinic n;die Klinik;The clinic is just around the corner.;Die Klinik ist gleich um die Ecke.;;;;;;;;;;;;;;;;;;;;;;;;
1001;Substantive;operation n;die Operation;I had an operation on my leg.;Ich hatte eine Operation am Bein.;The operation lasted for two hours.;Die Operation dauerte zwei Stunden.;;;;;;;;;;;;;;;;;;;;;;
1002;Verben;operate v;operieren;I'm afraid we'll have to operate on your stomach.;Wir müssen Sie leider am Magen operieren.;Can you operate such a machine?;Können Sie eine solche Maschine bedienen?;;;;;;;;;;;;;;;;;;;;;;
1003;Substantive;patient n;der Patient, die Patientin;The next patient was brought into the operating theatre.;Der nächste Patient wurde in den Operationssaal gebracht.;He is a patient in the General Hospital.;Er ist Patient im Allgemeinen Krankenhaus.;;;;;;;;;;;;;;;;;;;;;;
1004;Substantive;check-up n;die Vorsorgeuntersuchung;It's just a check-up.;Es ist nur eine Vorsorgeuntersuchung.;;;;;;;;;;;;;;;;;;;;;;;;
1005;Verben;X-ray v;röntgen;My elbow was X-rayed.;Mein Ellenbogen wurde geröntgt.;;;;;;;;;;;;;;;;;;;;;;;;
1006;Substantive;ointment n;die Salbe;He prescribed me an ointment for dry skin.;Er hat mir eine Salbe gegen trockene Haut verschrieben.;;;;;;;;;;;;;;;;;;;;;;;;
1007;Substantive;shot n;die Spritze;Have you had your shot yet?;Haben Sie schon Ihre Spritze bekommen?;Shots were heard in the night.;Schüsse waren in der Nacht zu hören.;His shot had missed.;Sein Schuss war danebengegangen.;;;;;;;;;;;;;;;;;;;;
1008;Substantive;injection n;die Injektion;The vet gave the dog a couple of injections.;Der Tierarzt hat dem Hund zwei Injektionen gegeben.;;;;;;;;;;;;;;;;;;;;;;;;
1009;Substantive;plaster n;das Pflaster;I need a plaster quick. My finger is bleeding.;Ich brauche schnell ein Pflaster. Mein Finger blutet.;;;;;;;;;;;;;;;;;;;;;;;;
1010;Substantive;Band-Aid® n AE;das Pflaster AE;Could you get me a Band-Aid?;Könntest du mir ein Pflaster holen?;;;;;;;;;;;;;;;;;;;;;;;;
1011;Substantive;bandage n;der Verband, die Binde;The nurse put a bandage on my hand.;Die Krankenschwester hat einen Verband um meine Hand gelegt.;;;;;;;;;;;;;;;;;;;;;;;;
1012;Adjektive und Adverbien;hygienic adj;hygienisch;The toilets didn't look very hygienic.;Die Toiletten sahen nicht sehr hygienisch aus.;;;;;;;;;;;;;;;;;;;;;;;;
1013;Substantive;wheelchair n;der Rollstuhl;Gavin's been confined to a wheelchair since the accident.;Seit seinem Unfall ist Gavin an den Rollstuhl gefesselt.;;;;;;;;;;;;;;;;;;;;;;;;
1014;Substantive;contraceptive n;das Verhütungsmittel;They were giving out free contraceptives at the disco.;In der Disko verteilten sie kostenlose Verhütungsmittel.;;;;;;;;;;;;;;;;;;;;;;;;
1015;Sonstige;to be on the pill;die Pille nehmen;Are you on the pill?;Nimmst du die Pille?;;;;;;;;;;;;;;;;;;;;;;;;
1016;Substantive;package insert n;die Packungsbeilage;Please read the package insert carefully.;Bitte lesen Sie die Packungsbeilage sorgfältig durch.;;;;;;;;;;;;;;;;;;;;;;;;
1017;Substantive;massage n;die Massage;Can you prescribe me a massage?;Können Sie mir eine Massage verschreiben?;;;;;;;;;;;;;;;;;;;;;;;;
1018;Substantive;waiting room n;das Wartezimmer;Please have a seat in the waiting room.;Bitte nehmen Sie im Wartezimmer Platz.;Ten patients were sitting in Dr. Taylor's waiting room.;Zehn Patienten saßen im Wartezimmer von Dr. Taylor.;The station has a comfortable waiting room.;Der Bahnhof hat einen komfortablen Wartesaal.;;;;;;;;;;;;;;;;;;;;
1019;Substantive;health insurance n;die Krankenversicherung;This operation is covered by health insurance.;Diese Operation wird von der Krankenversicherung übernommen.;;;;;;;;;;;;;;;;;;;;;;;;
1020;Substantive;medical certificate n;das (ärztliche) Attest;We require a medical certificate from all students.;Wir verlangen ein ärztliches Attest von allen Studenten.;;;;;;;;;;;;;;;;;;;;;;;;
1021;Substantive;danger n;die Gefahr;During and after the earthquake they were in great danger.;Während und nach dem Erdbeben schwebten sie in großer Gefahr.;Her life was in danger.;Ihr Leben war in Gefahr.;;;;;;;;;;;;;;;;;;;;;;
1022;Substantive;accident n;der Unfall;Call an ambulance! There's been an accident.;Ruf einen Krankenwagen! Da hat es einen Unfall gegeben.;Danny had an accident with his new car.;Danny hatte einen Unfall mit seinem neuen Wagen.;;;;;;;;;;;;;;;;;;;;;;
1023;Substantive;blaze n;der Brand;Several hundred houses were destroyed in the blaze.;Mehrere Hundert Häuser wurden durch den Brand zerstört.;;;;;;;;;;;;;;;;;;;;;;;;
1024;Verben;burn v;sich verbrennen, brennen;I almost burned my hand when I touched it.;Ich habe mir fast die Hand verbrannt, als ich es anfasste.;The forest burned throughout the night.;Der Wald brannte die ganze Nacht.;Jack burned a couple of CDs with African music for me.;Jack hat zwei CDs mit afrikanischer Musik für mich gebrannt.;She burnt the letter.;Sie verbrannte den Brief.;Their house was burning.;Ihr Haus brannte.;;;;;;;;;;;;;;;;
1025;Substantive;collision n;der Zusammenstoß;There was a collision between two commuter trains.;Es gab einen Zusammenstoß zwischen zwei Pendlerzügen.;;;;;;;;;;;;;;;;;;;;;;;;
1026;Verben;collide v;zusammenstoßen;Two submarines collided in the North Atlantic.;Zwei U-Boote stießen im Nordatlantik zusammen.;;;;;;;;;;;;;;;;;;;;;;;;
1027;Substantive;crash n;der Zusammenstoß;Luckily, nobody was injured in the crash.;Glücklicherweise wurde bei dem Zusammenstoß niemand verletzt.;Four people were killed in a car crash.;Vier Menschen kamen bei einem Autounfall um.;;;;;;;;;;;;;;;;;;;;;;
1028;Verben;crash v;zusammenstoßen, abstürzen;The local train crashed into the freight train.;Der Personenzug stieß mit dem Güterzug zusammen.;The plane crashed right after take-off.;Das Flugzeug stürzte gleich nach dem Start ab.;The plane crashed near the village.;Das Flugzeug stürzte in der Nähe des Dorfes ab.;;;;;;;;;;;;;;;;;;;;
1029;Adjektive und Adverbien;dangerous adj;gefährlich;It's quite dangerous to jump off this cliff.;Es ist ziemlich gefährlich, von dieser Klippe herunterzuspringen.;He is a dangerous man.;Er ist ein gefährlicher Mann.;;;;;;;;;;;;;;;;;;;;;;
1030;Verben;save v;retten, (ab)speichern, sparen;Everything imaginable should be done to save the gorillas.;Alles Erdenkliche sollte getan werden, um die Gorillas zu retten.;Where did I save the file I was working on?;Wo habe ich die Datei abgespeichert, an der ich gearbeitet habe?;Going by bike saves a lot of money and fuel.;Radfahren spart viel Geld und Treibstoff.;The boy saved the little girl's life.;Der Junge rettete dem kleinen Mädchen das Leben.;Their mother saved every penny.;Ihre Mutter sparte jeden Cent.;;;;;;;;;;;;;;;;
1031;Verben;rescue v;retten;The crew was rescued minutes before the ship sank.;Minuten bevor das Schiff sank, wurde die Crew gerettet.;The baby could be rescued from the fire.;Das Baby konnte aus dem Feuer gerettet werden.;;;;;;;;;;;;;;;;;;;;;;
1032;Verben;survive v;überleben;Only three sailors survived the collision.;Nur drei Seeleute überlebten den Zusammenstoß.;Will he survive?;Wird er überleben?;;;;;;;;;;;;;;;;;;;;;;
1033;Substantive;fire brigade n BE;die Feuerwehr BE;Sam's been a member of the volunteer fire brigade for years.;Seit Jahren ist Sam Mitglied der freiwilligen Feuerwehr.;;;;;;;;;;;;;;;;;;;;;;;;
1034;Substantive;fire department n AE;die Feuerwehr AE;Call the fire department! Just dial 911!;Ruf die Feuerwehr! Wähl einfach 911!;;;;;;;;;;;;;;;;;;;;;;;;
1035;Substantive;police n pl;die Polizei;The police have not been able to catch the burglar.;Die Polizei hat den Einbrecher nicht fassen können.;The police have (!) caught the thief.;Die Polizei hat den Dieb gefasst.;;;;;;;;;;;;;;;;;;;;;;
1036;Substantive;ambulance n;der Krankenwagen, der Rettungswagen;Mrs Benson was taken to hospital in the ambulance.;Mrs Benson wurde mit dem Krankenwagen ins Krankenhaus gebracht.;An ambulance took her to hospital.;Ein Krankenwagen brachte sie in die Klinik.;;;;;;;;;;;;;;;;;;;;;;
1037;Substantive;rescue service n;der Rettungsdienst;Only a few more minutes, the rescue service is on its way.;Nur noch ein paar Minuten, der Rettungsdienst ist unterwegs.;;;;;;;;;;;;;;;;;;;;;;;;
1038;Substantive;alarm n;der Alarm;When the alarm went off we all gathered in front of the garages.;Als der Alarm losging, versammelten wir uns alle vor den Garagen.;;;;;;;;;;;;;;;;;;;;;;;;
1039;Sonstige;Help! interj;Hilfe!;;;;;;;;;;;;;;;;;;;;;;;;;;
1040;Sonstige;to call for help;um Hilfe rufen;The boy fell through the ice and his friends called for help.;Der Junge brach ins Eis ein und seine Freunde riefen um Hilfe.;;;;;;;;;;;;;;;;;;;;;;;;
1041;Substantive;emergency number n;die Notrufnummer;If your car breaks down, you can ring the emergency number.;Wenn Ihr Auto eine Panne hat, können Sie die Notrufnummer wählen.;;;;;;;;;;;;;;;;;;;;;;;;
1042;Substantive;Accident and Emergency Department n, A&E n BE;die Notaufnahme BE;How do I get to A&E?;Wie komme ich zur Notaufnahme?;;;;;;;;;;;;;;;;;;;;;;;;
1043;Substantive;Emergency Room n, ER n AE;die Notaufnahme AE;The Emergency Room is on the first floor.;Die Notaufnahme ist im Parterre.;;;;;;;;;;;;;;;;;;;;;;;;
1044;Sonstige;to apply first aid;Erste Hilfe leisten;Is there anybody here who can apply first aid?;Ist hier jemand, der Erste Hilfe leisten kann?;;;;;;;;;;;;;;;;;;;;;;;;
1045;Substantive;emergency exit n;der Notausgang;Where's the emergency exit?;Wo ist der Notausgang?;;;;;;;;;;;;;;;;;;;;;;;;
1046;Verben;wash v;sich waschen, waschen;Simon got up, washed and left the house in a hurry.;Simon stand auf, wusch sich und verließ eilends das Haus.;Do I have to wash this wool jumper by hand?;Muss ich diesen Wollpullover mit der Hand waschen?;I washed before going to bed.;Ich wusch mich vor dem Zubettgehen.;I must go and wash my hands.;Ich muss mir die Hände waschen.;;;;;;;;;;;;;;;;;;
1047;Sonstige;to have a shower;duschen;Why does the phone always ring when I'm having a shower?;Warum klingelt das Telefon immer dann, wenn ich dusche?;;;;;;;;;;;;;;;;;;;;;;;;
1048;Sonstige;to have a bath BE;baden BE;I was just having a bath when the postman knocked at the door.;Ich badete gerade, als der Postbote an der Tür klopfte.;;;;;;;;;;;;;;;;;;;;;;;;
1049;Sonstige;to take a bath AE;baden AE;How often do you take a bath? Once a week?;Wie oft badest du? Einmal pro Woche?;;;;;;;;;;;;;;;;;;;;;;;;
1050;Substantive;shampoo n;das Shampoo;Could you get me some new shampoo from the supermarket, please?;Könntest du mir ein neues Shampoo aus dem Supermarkt mitbringen?;;;;;;;;;;;;;;;;;;;;;;;;
1051;Substantive;shower gel n;das Duschgel;Your new shower gel smells very sweet.;Dein neues Duschgel riecht sehr süß.;;;;;;;;;;;;;;;;;;;;;;;;
1052;Substantive;soap n;die Seife;We're out of soap, honey.;Liebling, wir haben keine Seife mehr.;Use plenty of soap and water.;Nimm viel Seife und Wasser!;;;;;;;;;;;;;;;;;;;;;;
1053;Substantive;cream n;die Creme, die Sahne, der Rahm;I need to put on some cream. My hands are all dry.;Ich muss etwas Creme auftragen. Meine Hände sind ganz trocken.;Do you take cream in your coffee?;Nehmen Sie Sahne zum Kaffee?;We filled the cake with chocolate cream.;Wir füllten den Kuchen mit Schokoladencreme.;;;;;;;;;;;;;;;;;;;;
1054;Verben;dry v;abtrocknen, trocknen;Would one of you please help me dry the dishes?;Würde einer von euch mir bitte helfen, das Geschirr abzutrocknen?;Please hang up your raincoat in the bathroom to dry.;Hänge bitte deinen Regenmantel ins Bad, damit er trocknet.;;;;;;;;;;;;;;;;;;;;;;
1055;Substantive;comb n;der Kamm;You seem to have lost my comb.;Du scheinst wohl meinen Kamm verloren zu haben.;We use a brush and comb to do our hair.;Wir benützen zum Frisieren Kamm und Bürste.;;;;;;;;;;;;;;;;;;;;;;
1056;Verben;comb v;(sich) kämmen;Please comb your hair before you leave the house.;Bitte kämm deine Haare, bevor du das Haus verlässt.;You must comb your hair.;Du musst deine Haare kämmen.;;;;;;;;;;;;;;;;;;;;;;
1057;Substantive;hairbrush n;die Haarbürste;I never use a hairbrush. I prefer a comb.;Ich benutze nie eine Haarbürste. Ich bevorzuge einen Kamm.;;;;;;;;;;;;;;;;;;;;;;;;
1058;Verben;brush v;bürsten;Could you brush your hair at least once a day?;Könntest du deine Haare nicht wenigstens einmal am Tag bürsten?;Sandy brushed her hair.;Sandy bürstete ihr Haar.;;;;;;;;;;;;;;;;;;;;;;
1059;Substantive;toothbrush n;die Zahnbürste;Colin forgot to take his toothbrush.;Colin hat vergessen, seine Zahnbürste mitzunehmen.;Don't forget your toothbrush.;Vergiss deine Zahnbürste nicht!;;;;;;;;;;;;;;;;;;;;;;
1060;Sonstige;to brush one's teeth;Zähne putzen;Why don't you use the commercial break to brush your teeth?;Warum nutzt du nicht die Werbepause, um dir die Zähne zu putzen?;;;;;;;;;;;;;;;;;;;;;;;;
1061;Substantive;toothpaste n;die Zahnpasta;Conny put some toothpaste on her toothbrush.;Conny hat etwas Zahnpasta auf ihre Zahnbürste getan.;Is there no toothpaste left?;Ist keine Zahnpasta mehr da?;;;;;;;;;;;;;;;;;;;;;;
1062;Substantive;razor n;der Rasierapparat;My wife gave me a razor for Christmas.;Meine Frau hat mir einen Rasierapparat zu Weihnachten geschenkt.;Do you use an electric razor?;Benutzen Sie einen Elektrorasierer?;;;;;;;;;;;;;;;;;;;;;;
1063;Verben;shave v;sich rasieren;My beard grows quickly. I have to shave twice a day.;Mein Bart wächst schnell. Ich muss mich zweimal am Tag rasieren.;Tom shaves every morning.;Tom rasiert sich jeden Morgen.;He has shaved off his beard.;Er hat seinen Bart abrasiert.;;;;;;;;;;;;;;;;;;;;
1064;Substantive;handkerchief n;das Taschentuch;Could you pass me a handkerchief? My nose is running.;Könntest du mir ein Taschentuch reichen? Meine Nase läuft.;I didn't have a handkerchief with me.;Ich hatte kein Taschentuch dabei.;;;;;;;;;;;;;;;;;;;;;;
1065;Substantive;tissue n;das Taschentuch;I have a box of tissues on the bedside table.;Ich habe eine Schachtel mit Taschentüchern auf dem Nachttisch.;;;;;;;;;;;;;;;;;;;;;;;;
1066;Substantive;Kleenex® n AE;das Taschentuch AE;;;;;;;;;;;;;;;;;;;;;;;;;;
1067;Substantive;perfume n;das Parfum;This is quite an expensive perfume.;Das ist ein ziemlich teures Parfüm.;;;;;;;;;;;;;;;;;;;;;;;;
1068;Substantive;toilet paper n BE;das Toilettenpapier BE;There was no toilet paper in the bathroom.;Im Bad war kein Toilettenpapier.;;;;;;;;;;;;;;;;;;;;;;;;
1069;Substantive;bathroom tissue n AE;das Toilettenpapier AE;Please get some bathroom tissue from the supermarket.;Bring bitte Toilettenpapier aus dem Supermarkt mit.;;;;;;;;;;;;;;;;;;;;;;;;
1070;Substantive;nappy n BE;die Windel BE;Mum was changing the baby's nappy.;Mama wechselte die Windel des Babys.;;;;;;;;;;;;;;;;;;;;;;;;
1071;Substantive;diaper n AE;die Windel AE;And then she asked me to change the diaper.;Und dann hat sie mich gebeten, die Windel zu wechseln.;;;;;;;;;;;;;;;;;;;;;;;;
1072;Substantive;make-up n;das Make-up, die Schminke;My girlfriend never wears make-up.;Meine Freundin trägt nie Make-up.;She wears too much make-up.;Sie trägt zu viel Make-up.;;;;;;;;;;;;;;;;;;;;;;
1073;Sonstige;to put on make-up;sich schminken;I'll be ready in a minute. I just have to put on some make-up.;Ich bin in einer Minute fertig. Ich muss mich nur noch schminken.;;;;;;;;;;;;;;;;;;;;;;;;
1074;Sonstige;to get dressed up;sich schön machen;Come on, girls! Let's get dressed up and go out.;Los, Mädels! Machen wir uns schön und gehen aus.;;;;;;;;;;;;;;;;;;;;;;;;
1075;Substantive;nail polish n;der Nagellack;How much did you pay for that nail polish?;Wie viel hast du für diesen Nagellack bezahlt?;;;;;;;;;;;;;;;;;;;;;;;;
1076;Substantive;nail varnish n BE;der Nagellack BE;Could you lend me your nail varnish? Just for tonight.;Könntest du mir deinen Nagellack leihen? Nur für heute Abend.;;;;;;;;;;;;;;;;;;;;;;;;
